会員ID,氏名,生年月日,性別,電話番号,住所
M000001,佐々木 隆,1922-03-03,男性,090-3961-3888,神奈川県横浜市青葉区美しが丘3丁目14-18
M000002,井上 恵,1925-03-03,女性,090-2212-6058,神奈川県横浜市青葉区たまプラーザ1丁目11-10
M000003,渡辺 遥,1974-12-09,女性,090-6124-8185,千葉県市川市国府台5丁目29-1
M000004,木村 さくら,1958-10-06,女性,090-6161-2924,東京都世田谷区上北沢3丁目13-15
M000005,吉田 聡,1975-11-20,男性,090-8202-2110,神奈川県川崎市宮前区宮崎5丁目17-11
M000006,高橋 誠,1992-06-27,男性,090-7028-5294,神奈川県藤沢市湘南台1丁目10-1
M000007,木村 愛,2003-05-16,女性,090-5490-7096,東京都八王子市南大沢2丁目3-6
M000008,高橋 拓也,1987-08-12,男性,090-1916-6215,神奈川県藤沢市辻堂5丁目28-10
M000009,小林 遥,1998-07-20,女性,090-2968-3894,神奈川県川崎市宮前区鷺沼1丁目21-18
M000010,佐藤 杏,1985-08-19,女性,090-3169-5182,埼玉県さいたま市浦和区常盤4丁目2-4
M000011,井上 直樹,1995-06-27,男性,090-7872-4542,神奈川県藤沢市辻堂4丁目8-17
M000012,山田 直樹,1988-10-14,男性,090-2419-2953,神奈川県川崎市宮前区宮崎2丁目15-15
M000013,吉田 恵,1952-01-26,女性,090-7509-5929,千葉県市川市八幡5丁目13-4
M000014,松本 直樹,1993-07-14,男性,090-6704-9328,東京都大田区蒲田1丁目27-13
M000015,佐藤 さくら,1969-06-22,女性,090-4233-7144,埼玉県さいたま市浦和区岸町1丁目4-5
M000016,井上 彩,1991-10-12,女性,090-1950-3746,埼玉県川口市並木5丁目4-5
M000017,井上 拓也,1989-04-25,男性,090-1725-8017,埼玉県さいたま市浦和区北浦和4丁目9-3
M000018,伊藤 大輔,1977-11-08,男性,090-7608-4678,東京都杉並区高円寺3丁目16-12
M000019,吉田 麻衣,1991-05-07,女性,090-9918-3569,東京都八王子市めじろ台5丁目15-3
M000020,伊藤 杏,1972-03-09,女性,090-7167-2650,埼玉県川口市並木4丁目26-2
M000021,鈴木 直樹,2000-11-28,男性,090-9802-7285,千葉県市川市八幡2丁目16-16
M000022,渡辺 直樹,1988-12-07,男性,090-3891-6304,東京都杉並区高円寺3丁目1-2
M000023,井上 愛,1961-01-18,女性,090-7562-3167,神奈川県川崎市宮前区有馬3丁目26-2
M000024,木村 大輔,1959-09-14,男性,090-1598-7008,東京都杉並区高円寺4丁目18-8
M000025,渡辺 直樹,1966-12-16,男性,090-5428-6290,神奈川県川崎市宮前区有馬4丁目2-18
M000026,山田 翔太,1992-10-18,男性,090-5970-1138,東京都大田区蒲田3丁目13-4
M000027,加藤 彩,1992-06-28,女性,090-1001-9811,埼玉県川口市芝3丁目8-10
M000028,吉田 陽子,1976-11-18,女性,090-9438-8411,神奈川県川崎市宮前区有馬1丁目8-18
M000029,井上 拓也,1951-01-13,男性,090-4322-9673,千葉県市川市国府台4丁目10-2
M000030,高橋 聡,1994-05-02,男性,090-7272-8696,東京都世田谷区上北沢4丁目21-11
M000031,山田 翔太,1984-08-10,男性,090-5180-9683,東京都世田谷区上北沢4丁目22-3
M000032,鈴木 由美,1983-12-03,女性,090-3604-5390,東京都世田谷区経堂5丁目9-16
M000033,吉田 彩,1984-09-21,女性,090-6096-9499,千葉県市川市行徳2丁目25-19
M000034,山本 由美,1989-12-21,女性,090-3781-9414,千葉県市川市国府台4丁目2-5
M000035,松本 聡,1988-03-08,男性,090-4562-8791,東京都杉並区阿佐谷5丁目29-18
M000036,井上 さくら,1991-12-14,女性,090-7779-3091,神奈川県川崎市宮前区有馬1丁目21-6
M000037,高橋 隆,1970-04-24,男性,090-8425-2544,埼玉県さいたま市浦和区岸町2丁目18-18
M000038,吉田 翔太,1954-01-20,男性,090-5641-2394,埼玉県さいたま市浦和区岸町5丁目6-5
M000039,高橋 陽子,1997-01-09,女性,090-5531-1300,神奈川県横浜市青葉区市ケ尾1丁目11-16
M000040,佐々木 亮,1987-11-07,男性,090-4121-1008,東京都杉並区高円寺2丁目5-6
M000041,山本 杏,1994-02-27,女性,090-1950-5486,神奈川県藤沢市辻堂2丁目29-13
M000042,伊藤 浩二,1995-10-17,男性,090-5548-3842,神奈川県横浜市青葉区美しが丘2丁目27-19
M000043,木村 隆,1976-10-14,男性,090-3900-3311,神奈川県横浜市青葉区たまプラーザ3丁目13-16
M000044,山本 浩二,1990-08-08,男性,090-9163-1861,東京都世田谷区赤堤1丁目8-16
M000045,小林 聡,1998-03-16,男性,090-5839-5715,埼玉県さいたま市浦和区岸町2丁目23-17
M000046,小林 愛,1977-01-27,女性,090-3921-4451,千葉県市川市国府台4丁目11-7
M000047,山田 隆,1960-11-22,男性,090-2458-6985,神奈川県川崎市宮前区鷺沼2丁目1-19
M000048,田中 大輔,1965-11-05,男性,090-3687-3791,東京都世田谷区赤堤3丁目1-5
M000049,山本 彩,1964-10-24,女性,090-9416-6793,神奈川県横浜市青葉区美しが丘1丁目24-5
M000050,佐藤 聡,1969-10-20,男性,090-8965-7171,神奈川県川崎市宮前区有馬4丁目25-3
M000051,中村 遥,1946-01-09,女性,090-8205-6497,千葉県市川市行徳3丁目22-15
M000052,渡辺 美咲,1969-07-10,女性,090-1414-4960,東京都世田谷区経堂2丁目7-10
M000053,佐藤 聡,1978-04-10,男性,090-2544-3100,神奈川県川崎市宮前区宮崎5丁目18-13
M000054,山田 さくら,1962-06-17,女性,090-6042-1524,東京都大田区田園調布4丁目14-1
M000055,鈴木 大輔,1986-09-03,男性,090-4278-4677,千葉県市川市八幡5丁目29-19
M000056,鈴木 麻衣,1957-10-04,女性,090-8384-5806,埼玉県さいたま市浦和区岸町3丁目22-15
M000057,小林 さくら,1948-04-28,女性,090-2072-8152,埼玉県さいたま市浦和区北浦和1丁目14-3
M000058,中村 杏,1947-10-04,女性,090-3890-5382,千葉県船橋市習志野台3丁目4-17
M000059,伊藤 彩,1942-11-21,女性,090-4060-7307,神奈川県横浜市青葉区たまプラーザ4丁目26-6
M000060,佐々木 隆,1968-11-22,男性,090-5711-4972,東京都世田谷区赤堤4丁目24-2
M000061,高橋 さくら,1987-10-04,女性,090-6754-6422,東京都世田谷区上北沢2丁目1-9
M000062,鈴木 隆,1996-11-14,男性,090-9120-8713,東京都杉並区高円寺5丁目22-6
M000063,加藤 美咲,2000-12-25,女性,090-2772-1579,千葉県船橋市本町1丁目2-1
M000064,伊藤 亮,1958-08-22,男性,090-1523-2911,神奈川県横浜市青葉区たまプラーザ5丁目3-14
M000065,佐々木 麻衣,1966-12-27,女性,090-9786-6217,東京都世田谷区赤堤5丁目20-14
M000066,木村 浩二,1975-07-18,男性,090-7478-7694,東京都世田谷区経堂4丁目1-8
M000067,山田 愛,1953-05-28,女性,090-8932-6770,埼玉県川口市並木5丁目19-16
M000068,鈴木 大輔,1956-05-28,男性,090-1086-6345,神奈川県横浜市青葉区たまプラーザ4丁目9-4
M000069,佐々木 杏,1992-11-19,女性,090-8434-4162,千葉県船橋市北習志野2丁目22-6
M000070,渡辺 亮,1973-10-14,男性,090-7374-3973,東京都大田区大森1丁目27-14
M000071,加藤 さくら,1986-09-21,女性,090-3689-5497,千葉県市川市国府台4丁目26-18
M000072,井上 恵,1973-11-20,女性,090-9473-8425,東京都八王子市南大沢1丁目9-5
M000073,田中 直樹,1978-01-21,男性,090-3708-1855,東京都八王子市北野2丁目23-5
M000074,井上 杏,1986-03-26,女性,090-7054-7886,東京都八王子市南大沢4丁目24-9
M000075,中村 さくら,2000-12-27,女性,090-3484-9504,東京都八王子市めじろ台2丁目28-15
M000076,山本 誠,2004-06-11,男性,090-7522-6768,東京都八王子市南大沢2丁目14-2
M000077,木村 杏,1989-06-26,女性,090-4976-9517,東京都世田谷区経堂3丁目26-18
M000078,井上 翔太,1977-03-01,男性,090-7326-5569,東京都杉並区阿佐谷1丁目20-16
M000079,木村 遥,1942-11-27,女性,090-9058-5116,神奈川県川崎市宮前区鷺沼1丁目13-16
M000080,渡辺 彩,1953-12-13,女性,090-4135-2649,東京都世田谷区上北沢5丁目15-18
M000081,小林 遥,1980-03-16,女性,090-7690-9823,埼玉県川口市並木1丁目8-3
M000082,田中 美咲,1974-08-19,女性,090-5284-6169,神奈川県横浜市青葉区たまプラーザ2丁目4-1
M000083,渡辺 拓也,1988-12-18,男性,090-7278-5925,神奈川県藤沢市善行1丁目3-9
M000084,伊藤 麻衣,1974-08-21,女性,090-4557-5182,東京都杉並区阿佐谷3丁目25-18
M000085,渡辺 翔太,1978-11-14,男性,090-3579-7099,埼玉県川口市芝2丁目2-18
M000086,小林 大輔,1969-03-16,男性,090-3910-2378,千葉県市川市八幡4丁目10-11
M000087,佐々木 誠,2006-09-25,男性,090-5894-5631,東京都杉並区荻窪1丁目11-3
M000088,田中 亮,1975-10-10,男性,090-4490-4816,埼玉県川口市芝4丁目17-3
M000089,山本 拓也,1982-12-15,男性,090-2476-9993,千葉県市川市八幡5丁目17-4
M000090,井上 遥,1977-08-24,女性,090-3078-6179,埼玉県さいたま市浦和区常盤4丁目24-17
M000091,加藤 聡,1973-07-25,男性,090-7703-2523,東京都八王子市めじろ台2丁目7-14
M000092,松本 彩,1988-02-18,女性,090-1710-7731,東京都杉並区荻窪4丁目17-6
M000093,中村 陽子,2006-02-25,女性,090-1613-5578,東京都八王子市南大沢5丁目25-7
M000094,吉田 彩,1984-12-06,女性,090-2389-8258,千葉県船橋市北習志野1丁目2-14
M000095,吉田 直樹,1982-10-26,男性,090-6834-2402,千葉県船橋市北習志野5丁目23-19
M000096,木村 大輔,1990-03-15,男性,090-4813-4370,神奈川県川崎市宮前区鷺沼4丁目18-1
M000097,加藤 さくら,1984-02-02,女性,090-4699-5443,東京都世田谷区上北沢3丁目23-17
M000098,加藤 直樹,1997-03-04,男性,090-9865-1345,神奈川県横浜市青葉区市ケ尾5丁目27-10
M000099,吉田 健一,1959-04-05,男性,090-9852-8271,神奈川県横浜市青葉区たまプラーザ1丁目17-13
M000100,佐藤 亮,1971-01-03,男性,090-7658-9636,埼玉県川口市戸塚2丁目28-18
M000101,松本 愛,1956-09-01,女性,090-9774-4290,神奈川県川崎市宮前区鷺沼1丁目27-10
M000102,吉田 健一,2006-07-09,男性,090-1774-5445,千葉県市川市行徳4丁目5-14
M000103,鈴木 陽子,1974-07-13,女性,090-2313-9681,千葉県市川市八幡1丁目25-10
M000104,佐々木 麻衣,1976-10-26,女性,090-4574-2275,東京都大田区蒲田4丁目28-12
M000105,渡辺 健一,1979-08-15,男性,090-7448-6109,神奈川県川崎市宮前区宮崎5丁目29-3
M000106,小林 陽子,1979-10-10,女性,090-7280-5572,東京都大田区蒲田4丁目7-17
M000107,伊藤 美咲,1970-12-26,女性,090-6403-5995,神奈川県藤沢市善行5丁目28-3
M000108,山田 さくら,1996-01-21,女性,090-6717-6223,東京都杉並区阿佐谷3丁目21-11
M000109,佐々木 陽子,1991-12-22,女性,090-8800-3990,神奈川県横浜市青葉区美しが丘1丁目27-2
M000110,山本 陽子,1961-07-08,女性,090-2301-9490,埼玉県川口市芝4丁目26-11
M000111,山本 陽子,1996-09-12,女性,090-4796-9754,千葉県船橋市本町2丁目29-10
M000112,小林 亮,2005-09-06,男性,090-9075-5182,東京都世田谷区赤堤1丁目24-14
M000113,佐々木 聡,1990-03-13,男性,090-8911-9751,神奈川県横浜市青葉区市ケ尾3丁目24-19
M000114,鈴木 誠,1979-12-11,男性,090-7354-7261,東京都杉並区荻窪1丁目8-16
M000115,高橋 彩,1977-12-25,女性,090-7918-3131,埼玉県さいたま市浦和区北浦和5丁目14-1
M000116,佐々木 愛,1968-01-19,女性,090-3297-2813,神奈川県川崎市宮前区鷺沼1丁目14-6
M000117,小林 翔太,1999-08-21,男性,090-5962-3965,埼玉県川口市並木5丁目28-4
M000118,吉田 拓也,2006-05-22,男性,090-6839-9248,千葉県市川市国府台4丁目22-2
M000119,松本 健一,1972-08-18,男性,090-9382-1316,東京都八王子市北野5丁目25-19
M000120,加藤 聡,1964-02-13,男性,090-9814-1171,神奈川県横浜市青葉区市ケ尾4丁目3-19
M000121,山田 彩,1960-04-17,女性,090-7519-1945,東京都大田区蒲田5丁目26-10
M000122,松本 大輔,1974-12-01,男性,090-2646-9990,埼玉県川口市戸塚3丁目5-2
M000123,田中 大輔,1978-07-16,男性,090-7009-8445,東京都八王子市南大沢1丁目26-15
M000124,木村 由美,1993-03-02,女性,090-8225-7442,東京都世田谷区経堂3丁目12-6
M000125,田中 さくら,1979-05-02,女性,090-4428-4806,東京都杉並区高円寺3丁目10-18
M000126,井上 陽子,2001-06-15,女性,090-6922-8714,千葉県市川市八幡1丁目4-1
M000127,松本 健一,2006-04-15,男性,090-5988-7766,神奈川県藤沢市辻堂2丁目17-10
M000128,高橋 彩,1987-11-21,女性,090-3013-3950,埼玉県川口市戸塚3丁目29-18
M000129,鈴木 彩,1974-07-17,女性,090-8289-6264,神奈川県川崎市宮前区鷺沼3丁目8-15
M000130,渡辺 隆,1982-06-12,男性,090-5500-9276,千葉県船橋市習志野台4丁目20-13
M000131,伊藤 浩二,1969-07-08,男性,090-4448-7264,神奈川県横浜市青葉区美しが丘1丁目11-12
M000132,加藤 直樹,1964-02-14,男性,090-9872-8063,東京都杉並区高円寺3丁目18-7
M000133,伊藤 美咲,1976-01-20,女性,090-8964-6601,神奈川県藤沢市辻堂4丁目17-12
M000134,中村 陽子,1988-09-11,女性,090-5708-3936,東京都八王子市北野3丁目12-9
M000135,松本 大輔,1984-07-04,男性,090-2658-6667,千葉県船橋市本町1丁目2-19
M000136,山本 亮,1966-06-19,男性,090-1772-1232,神奈川県横浜市青葉区美しが丘4丁目11-2
M000137,木村 聡,1975-05-20,男性,090-9985-3518,神奈川県川崎市宮前区宮崎5丁目19-12
M000138,木村 麻衣,1989-10-26,女性,090-1922-4898,埼玉県川口市並木4丁目4-2
M000139,井上 遥,1998-08-13,女性,090-7579-7142,東京都世田谷区経堂3丁目26-9
M000140,田中 拓也,1963-09-10,男性,090-6194-5441,埼玉県川口市戸塚4丁目10-7
M000141,佐藤 遥,1968-09-15,女性,090-7094-9747,東京都大田区田園調布1丁目12-15
M000142,佐藤 麻衣,1965-08-01,女性,090-9870-6397,埼玉県川口市芝1丁目12-1
M000143,鈴木 陽子,1987-04-15,女性,090-3598-9774,神奈川県川崎市宮前区鷺沼5丁目19-9
M000144,山本 誠,1991-07-22,男性,090-7823-5791,千葉県市川市国府台5丁目1-9
M000145,山田 由美,2006-08-13,女性,090-4832-7705,千葉県船橋市習志野台4丁目15-15
M000146,小林 大輔,1994-02-27,男性,090-3118-1788,千葉県市川市行徳1丁目10-14
M000147,高橋 彩,1990-11-16,女性,090-8168-3516,神奈川県川崎市宮前区有馬4丁目25-7
M000148,木村 聡,1958-05-09,男性,090-8706-5339,埼玉県さいたま市浦和区岸町5丁目14-8
M000149,田中 亮,1992-06-09,男性,090-5580-2930,埼玉県川口市芝3丁目2-18
M000150,鈴木 拓也,1996-03-28,男性,090-3491-4988,東京都世田谷区赤堤5丁目15-12
M000151,渡辺 麻衣,1968-06-23,女性,090-5555-5088,埼玉県さいたま市浦和区岸町5丁目17-1
M000152,吉田 由美,1965-04-04,女性,090-7588-4871,東京都世田谷区上北沢4丁目19-13
M000153,伊藤 彩,1962-11-11,女性,090-1479-3055,東京都杉並区阿佐谷5丁目15-17
M000154,松本 恵,1996-05-03,女性,090-7092-6833,埼玉県さいたま市浦和区岸町1丁目11-18
M000155,山本 健一,1988-03-28,男性,090-5503-9622,東京都大田区大森4丁目14-1
M000156,中村 恵,1970-01-18,女性,090-6454-1563,東京都世田谷区経堂1丁目12-4
M000157,吉田 陽子,2006-01-28,女性,090-6053-9401,埼玉県さいたま市浦和区岸町3丁目5-9
M000158,山本 誠,1965-01-21,男性,090-3926-8439,千葉県船橋市北習志野1丁目7-11
M000159,松本 愛,1981-03-24,女性,090-1283-6202,埼玉県川口市芝5丁目25-6
M000160,渡辺 直樹,1972-11-06,男性,090-3375-3372,埼玉県川口市戸塚5丁目28-18
M000161,小林 美咲,2006-05-28,女性,090-2026-5565,埼玉県さいたま市浦和区常盤5丁目28-2
M000162,鈴木 恵,1995-04-28,女性,090-2832-6370,埼玉県川口市芝1丁目6-18
M000163,吉田 翔太,1976-04-02,男性,090-5088-2785,東京都八王子市めじろ台5丁目20-10
M000164,山本 杏,1980-01-21,女性,090-8539-2021,神奈川県横浜市青葉区美しが丘1丁目12-13
M000165,吉田 亮,1970-12-26,男性,090-1977-8920,東京都杉並区高円寺2丁目25-12
M000166,山田 健一,1964-06-10,男性,090-7015-1654,千葉県市川市八幡5丁目7-8
M000167,山田 杏,2006-07-05,女性,090-3189-4172,東京都大田区蒲田3丁目8-13
M000168,田中 拓也,1962-01-07,男性,090-8900-8868,千葉県市川市行徳4丁目4-8
M000169,松本 恵,1966-06-16,女性,090-6053-9404,東京都大田区蒲田1丁目12-3
M000170,加藤 陽子,1987-05-22,女性,090-3132-3748,神奈川県藤沢市辻堂1丁目25-14
M000171,高橋 健一,1973-10-19,男性,090-5290-8023,千葉県船橋市習志野台5丁目8-11
M000172,伊藤 健一,1999-02-07,男性,090-1538-5463,神奈川県藤沢市善行2丁目3-18
M000173,佐藤 翔太,1995-03-09,男性,090-6185-2289,東京都大田区大森4丁目20-3
M000174,伊藤 聡,1971-03-03,男性,090-4257-9140,神奈川県横浜市青葉区美しが丘4丁目17-4
M000175,中村 亮,1980-06-16,男性,090-7197-6748,東京都杉並区阿佐谷2丁目4-9
M000176,伊藤 遥,1954-04-19,女性,090-7152-2021,千葉県市川市八幡4丁目1-7
M000177,鈴木 彩,1999-12-08,女性,090-6243-7034,埼玉県さいたま市浦和区北浦和1丁目20-10
M000178,鈴木 誠,1972-04-13,男性,090-6141-7133,東京都杉並区阿佐谷1丁目15-3
M000179,高橋 陽子,2003-08-13,女性,090-1485-2569,神奈川県藤沢市辻堂2丁目17-7
M000180,渡辺 誠,1977-05-23,男性,090-6733-8140,東京都世田谷区赤堤5丁目7-10
M000181,渡辺 隆,1960-05-10,男性,090-6047-8558,東京都八王子市北野4丁目15-11
M000182,井上 彩,1992-02-21,女性,090-9951-5702,千葉県船橋市北習志野3丁目22-11
M000183,佐藤 さくら,1977-03-04,女性,090-3873-4460,埼玉県さいたま市浦和区岸町2丁目12-9
M000184,吉田 麻衣,1968-04-14,女性,090-9974-8058,東京都杉並区荻窪2丁目8-9
M000185,佐藤 陽子,1978-04-21,女性,090-8865-9249,神奈川県川崎市宮前区宮崎5丁目11-2
M000186,小林 浩二,1968-03-04,男性,090-2528-2241,神奈川県川崎市宮前区有馬3丁目29-14
M000187,加藤 大輔,2006-08-16,男性,090-5059-9032,東京都八王子市南大沢5丁目28-3
M000188,渡辺 遥,1982-03-13,女性,090-9771-4393,神奈川県川崎市宮前区宮崎4丁目14-17
M000189,伊藤 彩,1973-12-02,女性,090-7834-9801,神奈川県横浜市青葉区美しが丘2丁目19-6
M000190,高橋 遥,1993-12-16,女性,090-4528-9485,千葉県船橋市本町1丁目24-5
M000191,小林 浩二,1981-06-21,男性,090-1028-8525,東京都杉並区荻窪1丁目22-3
M000192,中村 浩二,1979-09-16,男性,090-7184-6863,神奈川県横浜市青葉区美しが丘1丁目16-17
M000193,伊藤 由美,1944-11-19,女性,090-2929-8184,神奈川県藤沢市辻堂1丁目2-14
M000194,佐藤 さくら,1962-02-14,女性,090-2268-9388,神奈川県川崎市宮前区鷺沼4丁目26-2
M000195,田中 直樹,1984-07-23,男性,090-4934-3080,千葉県市川市八幡5丁目7-10
M000196,中村 誠,1980-02-26,男性,090-5708-4168,千葉県船橋市習志野台2丁目20-3
M000197,鈴木 亮,1987-02-12,男性,090-5306-2629,埼玉県川口市芝4丁目7-3
M000198,鈴木 浩二,1973-08-04,男性,090-9637-7485,千葉県船橋市北習志野3丁目2-5
M000199,田中 美咲,1976-04-13,女性,090-1197-5141,千葉県市川市国府台1丁目13-18
M000200,井上 愛,1965-01-01,女性,090-7023-6506,千葉県市川市国府台3丁目11-13
M000201,佐藤 さくら,1970-03-24,女性,090-8224-1571,東京都世田谷区上北沢5丁目2-17
M000202,伊藤 由美,1954-04-27,女性,090-7444-4001,東京都世田谷区上北沢4丁目2-15
M000203,松本 健一,1995-09-02,男性,090-4088-5207,東京都杉並区阿佐谷2丁目20-12
M000204,小林 遥,2006-03-19,女性,090-4987-8804,神奈川県横浜市青葉区美しが丘3丁目5-4
M000205,山田 拓也,1982-11-06,男性,090-9788-1229,東京都八王子市北野1丁目28-12
M000206,田中 拓也,1967-10-08,男性,090-7099-8056,埼玉県さいたま市浦和区常盤1丁目10-1
M000207,佐々木 大輔,1958-02-22,男性,090-5268-2756,東京都世田谷区経堂3丁目11-19
M000208,山田 愛,1964-10-03,女性,090-8655-4955,東京都大田区蒲田1丁目14-19
M000209,中村 由美,1985-06-22,女性,090-4333-9641,東京都杉並区阿佐谷1丁目1-2
M000210,中村 由美,1993-09-27,女性,090-2321-5646,神奈川県横浜市青葉区市ケ尾4丁目1-19
M000211,井上 彩,1972-01-02,女性,090-7758-5154,千葉県市川市行徳1丁目6-19
M000212,小林 亮,2002-05-10,男性,090-3705-1497,埼玉県さいたま市浦和区岸町4丁目27-10
M000213,佐藤 杏,1985-06-18,女性,090-3792-2407,東京都大田区蒲田4丁目12-1
M000214,小林 健一,2004-12-16,男性,090-4959-5581,東京都大田区蒲田5丁目13-5
M000215,佐藤 愛,1998-06-06,女性,090-4468-1026,東京都杉並区荻窪4丁目28-15
M000216,佐々木 麻衣,1961-01-06,女性,090-3924-6211,東京都杉並区高円寺5丁目7-13
M000217,佐藤 隆,1963-04-24,男性,090-7403-2068,埼玉県さいたま市浦和区岸町4丁目29-1
M000218,松本 麻衣,1962-09-27,女性,090-9584-9229,東京都世田谷区上北沢3丁目17-11
M000219,田中 遥,1952-09-24,女性,090-8750-3146,東京都八王子市北野4丁目17-17
M000220,山田 浩二,1971-01-28,男性,090-8223-2510,埼玉県川口市並木4丁目26-17
M000221,加藤 彩,1968-04-06,女性,090-9376-4923,東京都世田谷区上北沢2丁目22-11
M000222,鈴木 浩二,1995-03-28,男性,090-8189-5543,埼玉県川口市芝1丁目7-2
M000223,佐々木 遥,1977-02-12,女性,090-4166-6047,東京都杉並区荻窪5丁目26-13
M000224,伊藤 大輔,1978-12-24,男性,090-8701-4655,神奈川県横浜市青葉区市ケ尾1丁目5-13
M000225,山田 大輔,2006-12-24,男性,090-1595-4964,埼玉県さいたま市浦和区常盤3丁目27-12
M000226,井上 由美,1942-04-21,女性,090-8449-9587,千葉県市川市行徳5丁目17-11
M000227,木村 大輔,1948-08-23,男性,090-9113-3038,千葉県船橋市本町4丁目17-7
M000228,中村 杏,1993-07-03,女性,090-1790-2124,神奈川県川崎市宮前区鷺沼1丁目9-7
M000229,高橋 さくら,1995-09-15,女性,090-5981-4536,東京都世田谷区上北沢4丁目14-11
M000230,木村 杏,1970-04-11,女性,090-2721-2449,千葉県船橋市本町4丁目4-11
M000231,伊藤 拓也,1963-03-04,男性,090-6439-7905,千葉県船橋市本町5丁目8-10
M000232,佐藤 遥,1965-04-28,女性,090-2385-1957,埼玉県さいたま市浦和区岸町4丁目26-11
M000233,吉田 愛,1984-06-15,女性,090-9501-3611,東京都八王子市南大沢3丁目3-10
M000234,佐々木 遥,1977-03-15,女性,090-7635-3409,千葉県市川市行徳5丁目8-18
M000235,小林 浩二,1978-07-15,男性,090-8032-5613,東京都世田谷区経堂4丁目28-11
M000236,吉田 翔太,1972-02-12,男性,090-9474-1237,神奈川県横浜市青葉区市ケ尾2丁目13-16
M000237,佐々木 誠,2006-12-09,男性,090-8954-7854,東京都世田谷区赤堤1丁目10-17
M000238,伊藤 健一,1970-05-22,男性,090-2044-5039,埼玉県さいたま市浦和区北浦和4丁目12-17
M000239,山田 さくら,1983-11-12,女性,090-2244-1038,埼玉県さいたま市浦和区岸町2丁目27-10
M000240,小林 由美,1983-12-24,女性,090-5141-3364,神奈川県藤沢市善行3丁目14-9
M000241,松本 大輔,1975-08-01,男性,090-8170-1030,埼玉県川口市戸塚3丁目25-1
M000242,鈴木 彩,2001-04-02,女性,090-3188-7852,神奈川県藤沢市辻堂4丁目10-15
M000243,田中 由美,1974-10-23,女性,090-2584-7040,神奈川県藤沢市辻堂5丁目17-2
M000244,佐々木 陽子,1996-04-19,女性,090-4220-9205,神奈川県藤沢市辻堂1丁目20-14
M000245,渡辺 愛,1972-08-14,女性,090-4980-2659,東京都大田区蒲田1丁目9-8
M000246,山田 拓也,1999-07-08,男性,090-4440-4168,神奈川県藤沢市善行2丁目27-19
M000247,吉田 麻衣,1999-08-10,女性,090-9076-7427,東京都杉並区高円寺5丁目18-6
M000248,小林 直樹,1994-08-04,男性,090-3979-1655,東京都大田区大森1丁目23-14
M000249,吉田 美咲,1970-02-03,女性,090-8724-7589,東京都杉並区阿佐谷4丁目13-10
M000250,加藤 さくら,1951-03-15,女性,090-4633-3767,東京都八王子市北野4丁目17-1
M000251,田中 聡,1961-08-04,男性,090-6084-3946,神奈川県藤沢市善行2丁目8-1
M000252,佐藤 愛,1993-11-20,女性,090-8774-5846,神奈川県横浜市青葉区美しが丘1丁目10-9
M000253,佐藤 恵,1987-10-01,女性,090-5428-7255,東京都世田谷区経堂4丁目25-19
M000254,山田 麻衣,1966-07-25,女性,090-9457-2831,東京都大田区蒲田2丁目7-18
M000255,山本 大輔,1985-02-23,男性,090-4084-7269,東京都世田谷区赤堤2丁目17-11
M000256,木村 杏,1978-04-25,女性,090-1071-7132,東京都世田谷区上北沢4丁目17-16
M000257,井上 翔太,2006-01-27,男性,090-9306-8603,千葉県船橋市北習志野4丁目1-2
M000258,渡辺 翔太,1973-05-22,男性,090-5927-5249,神奈川県横浜市青葉区たまプラーザ5丁目22-12
M000259,鈴木 由美,1987-03-03,女性,090-7067-4739,神奈川県横浜市青葉区美しが丘3丁目20-10
M000260,中村 亮,1993-04-02,男性,090-4406-7066,東京都杉並区阿佐谷4丁目4-17
M000261,松本 浩二,1950-09-06,男性,090-1593-8799,神奈川県川崎市宮前区有馬3丁目13-18
M000262,高橋 直樹,1971-01-01,男性,090-9845-7695,埼玉県さいたま市浦和区北浦和2丁目13-3
M000263,井上 彩,1992-01-25,女性,090-7804-5428,神奈川県横浜市青葉区たまプラーザ1丁目18-19
M000264,木村 恵,1985-11-26,女性,090-5406-8369,東京都大田区田園調布3丁目29-1
M000265,吉田 陽子,1990-11-17,女性,090-8085-2484,神奈川県川崎市宮前区宮崎3丁目20-1
M000266,渡辺 聡,2006-02-06,男性,090-4493-7701,東京都大田区蒲田4丁目11-14
M000267,加藤 翔太,1982-11-19,男性,090-3543-5399,東京都杉並区荻窪2丁目14-18
M000268,佐々木 健一,1971-11-16,男性,090-9050-1445,埼玉県さいたま市浦和区岸町2丁目27-15
M000269,田中 遥,2005-05-10,女性,090-2264-4135,神奈川県藤沢市湘南台1丁目12-5
M000270,佐藤 さくら,2002-05-14,女性,090-2006-9184,千葉県船橋市北習志野2丁目18-12
