会員ID,氏名,生年月日,性別,電話番号,住所
M000271,伊藤 遥,1987-09-23,女性,090-5284-7851,神奈川県横浜市青葉区美しが丘4丁目12-8
M000272,松本 聡,1981-01-22,男性,090-8919-4264,東京都世田谷区上北沢5丁目18-2
M000273,小林 美咲,1977-10-25,女性,090-3717-1779,神奈川県藤沢市善行4丁目27-4
M000274,鈴木 隆,2003-06-01,男性,090-3121-9088,東京都杉並区阿佐谷5丁目5-16
M000275,田中 拓也,1990-08-06,男性,090-9411-4420,千葉県市川市八幡3丁目10-1
M000276,鈴木 直樹,1984-12-13,男性,090-7867-4257,東京都世田谷区経堂2丁目21-9
M000277,山田 亮,1977-09-10,男性,090-8777-4752,神奈川県藤沢市善行4丁目12-1
M000278,加藤 拓也,1977-12-22,男性,090-1847-6923,埼玉県川口市並木3丁目23-5
M000279,加藤 健一,1996-10-16,男性,090-7082-2372,東京都杉並区阿佐谷4丁目26-2
M000280,高橋 翔太,1964-10-20,男性,090-5215-5211,神奈川県川崎市宮前区宮崎3丁目14-5
M000281,木村 亮,1990-06-11,男性,090-7512-1903,千葉県市川市国府台4丁目10-14
M000282,高橋 健一,1990-09-24,男性,090-5334-8724,東京都杉並区阿佐谷2丁目6-19
M000283,山田 健一,1989-06-08,男性,090-6873-4852,埼玉県さいたま市浦和区岸町1丁目11-1
M000284,加藤 誠,1953-04-16,男性,090-1081-5729,神奈川県横浜市青葉区美しが丘2丁目3-18
M000285,井上 杏,1981-02-24,女性,090-9363-8949,東京都大田区蒲田5丁目20-2
M000286,加藤 美咲,1980-09-26,女性,090-8798-3972,千葉県市川市八幡4丁目10-18
M000287,山田 亮,1991-10-24,男性,090-5302-4516,千葉県市川市八幡2丁目8-12
M000288,佐々木 彩,1965-09-27,女性,090-4028-8127,埼玉県川口市芝3丁目7-12
M000289,佐藤 麻衣,1970-06-01,女性,090-7003-3994,埼玉県さいたま市浦和区岸町4丁目17-12
M000290,田中 彩,1985-03-25,女性,090-7490-3913,東京都世田谷区上北沢2丁目15-13
M000291,鈴木 大輔,2000-04-14,男性,090-5480-6687,神奈川県藤沢市善行1丁目15-18
M000292,高橋 美咲,1959-08-26,女性,090-1618-6623,神奈川県藤沢市善行3丁目3-10
M000293,加藤 陽子,1982-02-07,女性,090-6984-4813,千葉県船橋市北習志野1丁目28-10
M000294,高橋 聡,1995-06-03,男性,090-1455-3196,東京都大田区蒲田3丁目14-10
M000295,木村 美咲,1990-04-07,女性,090-5101-4557,千葉県市川市八幡3丁目23-8
M000296,佐藤 翔太,2006-06-15,男性,090-8290-5024,東京都大田区田園調布2丁目20-8
M000297,小林 由美,1978-06-16,女性,090-7513-8455,神奈川県川崎市宮前区鷺沼4丁目9-3
M000298,加藤 直樹,1966-08-19,男性,090-4530-2372,神奈川県川崎市宮前区宮崎2丁目16-13
M000299,伊藤 陽子,1966-07-07,女性,090-2095-4302,東京都大田区大森1丁目3-8
M000300,木村 直樹,1990-10-05,男性,090-6724-7813,神奈川県藤沢市善行3丁目27-4
M000301,小林 遥,1991-03-08,女性,090-8053-7668,東京都世田谷区上北沢4丁目29-15
M000302,小林 大輔,1990-04-16,男性,090-4257-4654,神奈川県藤沢市湘南台3丁目27-18
M000303,山田 由美,1985-10-18,女性,090-3028-3635,神奈川県横浜市青葉区市ケ尾4丁目8-14
M000304,山田 由美,1990-12-19,女性,090-3027-9470,千葉県船橋市本町2丁目4-11
M000305,吉田 大輔,1959-12-05,男性,090-1180-7509,東京都大田区田園調布5丁目5-4
M000306,佐々木 隆,1990-02-15,男性,090-3545-4547,埼玉県さいたま市浦和区北浦和3丁目19-11
M000307,中村 誠,1968-02-24,男性,090-4235-4293,神奈川県横浜市青葉区美しが丘1丁目23-18
M000308,小林 さくら,1975-01-28,女性,090-3522-9916,東京都杉並区高円寺1丁目13-4
M000309,高橋 遥,1985-05-11,女性,090-1519-8290,神奈川県川崎市宮前区有馬4丁目10-6
M000310,吉田 健一,1972-01-11,男性,090-2027-9521,神奈川県横浜市青葉区美しが丘5丁目4-16
M000311,木村 聡,1991-11-16,男性,090-6245-8095,東京都大田区大森3丁目4-1
M000312,鈴木 拓也,1994-03-03,男性,090-3139-2495,埼玉県さいたま市浦和区北浦和1丁目14-4
M000313,松本 聡,1987-07-14,男性,090-9720-4265,東京都世田谷区赤堤2丁目4-5
M000314,伊藤 遥,1959-10-23,女性,090-6215-1949,神奈川県横浜市青葉区市ケ尾5丁目7-1
M000315,佐々木 浩二,1982-07-19,男性,090-3762-9473,神奈川県藤沢市湘南台2丁目9-8
M000316,鈴木 美咲,1958-12-27,女性,090-3302-5840,神奈川県横浜市青葉区たまプラーザ5丁目18-9
M000317,高橋 健一,1977-06-06,男性,090-8110-3979,神奈川県藤沢市湘南台1丁目9-12
M000318,伊藤 直樹,1970-06-21,男性,090-2335-8064,東京都大田区田園調布3丁目21-8
M000319,鈴木 陽子,2006-10-18,女性,090-7975-3281,東京都杉並区高円寺4丁目22-7
M000320,小林 拓也,1986-11-20,男性,090-2487-2761,千葉県市川市八幡4丁目7-18
M000321,田中 麻衣,1958-06-24,女性,090-1062-8603,東京都杉並区阿佐谷2丁目18-6
M000322,小林 彩,1984-05-25,女性,090-1067-9328,神奈川県横浜市青葉区美しが丘3丁目14-11
M000323,田中 聡,1993-09-28,男性,090-2254-2657,東京都八王子市南大沢1丁目28-1
M000324,小林 大輔,1982-11-27,男性,090-2594-6753,千葉県市川市国府台5丁目24-15
M000325,伊藤 愛,1978-04-08,女性,090-4973-2759,埼玉県川口市並木4丁目16-16
M000326,井上 拓也,1993-03-06,男性,090-9606-9675,東京都杉並区荻窪4丁目15-2
M000327,中村 さくら,1947-05-28,女性,090-6290-7599,埼玉県さいたま市浦和区常盤1丁目17-14
M000328,佐藤 隆,1977-12-11,男性,090-9882-4542,東京都大田区大森3丁目1-12
M000329,渡辺 美咲,1986-11-28,女性,090-6376-1191,千葉県市川市行徳2丁目25-17
M000330,木村 愛,1987-08-23,女性,090-6157-2978,神奈川県川崎市宮前区有馬2丁目27-13
M000331,松本 聡,1981-01-27,男性,090-6648-9904,東京都杉並区阿佐谷3丁目2-16
M000332,木村 直樹,1962-02-24,男性,090-5315-1936,千葉県船橋市北習志野2丁目24-4
M000333,佐々木 杏,1986-02-19,女性,090-4602-5175,埼玉県さいたま市浦和区常盤5丁目7-19
M000334,井上 直樹,1998-07-11,男性,090-1003-5274,神奈川県川崎市宮前区有馬4丁目28-7
M000335,渡辺 遥,1970-11-19,女性,090-7323-5521,東京都世田谷区上北沢2丁目23-6
M000336,中村 由美,2002-02-02,女性,090-7627-7885,神奈川県藤沢市善行1丁目19-9
M000337,井上 恵,2000-04-05,女性,090-9180-9215,東京都八王子市南大沢5丁目4-9
M000338,佐藤 隆,1958-11-11,男性,090-8596-4480,東京都八王子市北野1丁目8-8
M000339,佐藤 美咲,1974-09-19,女性,090-2352-1555,神奈川県藤沢市善行3丁目2-3
M000340,吉田 麻衣,1990-01-14,女性,090-1851-4690,東京都世田谷区経堂2丁目8-16
M000341,井上 直樹,1955-06-11,男性,090-3573-6557,埼玉県さいたま市浦和区北浦和1丁目5-10
M000342,田中 浩二,1959-05-17,男性,090-1651-7682,東京都世田谷区赤堤4丁目8-19
M000343,高橋 美咲,1957-04-10,女性,090-7878-2184,東京都八王子市北野4丁目2-17
M000344,加藤 彩,1953-10-20,女性,090-5847-3012,東京都大田区蒲田5丁目18-19
M000345,高橋 亮,1973-06-18,男性,090-1652-9483,東京都杉並区高円寺4丁目8-8
M000346,伊藤 杏,1952-10-10,女性,090-5193-3549,東京都大田区大森1丁目5-8
M000347,中村 拓也,1964-05-18,男性,090-5333-7802,千葉県市川市国府台2丁目19-5
M000348,加藤 隆,1957-03-03,男性,090-2577-8356,埼玉県川口市並木5丁目9-19
M000349,山本 誠,1984-03-02,男性,090-3779-8335,東京都杉並区荻窪5丁目2-8
M000350,山本 拓也,1983-06-11,男性,090-5287-8610,東京都世田谷区上北沢5丁目27-5
M000351,伊藤 大輔,1971-03-12,男性,090-4908-5488,東京都杉並区高円寺1丁目14-1
M000352,木村 浩二,1988-07-26,男性,090-1081-1063,埼玉県さいたま市浦和区常盤1丁目14-3
M000353,佐藤 麻衣,1981-02-22,女性,090-4599-4204,東京都杉並区阿佐谷5丁目22-3
M000354,吉田 愛,1974-11-25,女性,090-9082-8935,千葉県船橋市北習志野1丁目22-8
M000355,渡辺 麻衣,1971-06-19,女性,090-3992-3310,東京都八王子市北野4丁目12-19
M000356,中村 浩二,1963-10-23,男性,090-8911-1736,神奈川県川崎市宮前区宮崎3丁目14-18
M000357,木村 遥,1990-05-11,女性,090-3969-5725,神奈川県川崎市宮前区有馬5丁目13-6
M000358,加藤 翔太,1983-09-15,男性,090-6786-8921,神奈川県藤沢市善行3丁目29-3
M000359,佐々木 亮,2006-09-26,男性,090-5434-5256,東京都世田谷区経堂2丁目14-6
M000360,伊藤 由美,1969-01-12,女性,090-7332-2002,千葉県船橋市習志野台1丁目16-15
M000361,木村 誠,2006-05-28,男性,090-4341-4509,埼玉県さいたま市浦和区常盤2丁目13-19
M000362,山田 直樹,1966-10-25,男性,090-6632-4065,埼玉県川口市戸塚3丁目15-11
M000363,伊藤 拓也,1972-02-20,男性,090-9634-1574,千葉県船橋市習志野台2丁目14-11
M000364,佐々木 愛,1978-02-22,女性,090-3794-3522,神奈川県藤沢市善行1丁目25-15
M000365,佐藤 由美,1982-08-14,女性,090-6430-8273,神奈川県川崎市宮前区有馬4丁目6-6
M000366,佐々木 大輔,2006-04-02,男性,090-3273-4728,東京都八王子市めじろ台5丁目1-17
M000367,加藤 拓也,1975-11-06,男性,090-8206-5324,埼玉県川口市並木2丁目25-1
M000368,小林 聡,1956-06-18,男性,090-2050-3549,東京都八王子市めじろ台4丁目5-18
M000369,高橋 隆,1955-07-03,男性,090-1918-6633,埼玉県さいたま市浦和区常盤2丁目12-9
M000370,井上 陽子,1953-02-24,女性,090-2609-9528,千葉県船橋市習志野台3丁目9-17
M000371,山田 由美,1949-04-16,女性,090-2167-8210,東京都大田区蒲田4丁目22-4
M000372,小林 麻衣,1960-07-27,女性,090-8777-3329,千葉県市川市行徳2丁目20-11
M000373,木村 恵,1985-04-22,女性,090-5522-4675,埼玉県川口市芝4丁目25-4
M000374,吉田 直樹,1984-03-17,男性,090-5979-7992,千葉県市川市八幡5丁目11-19
M000375,山田 拓也,1996-08-21,男性,090-3279-3508,千葉県船橋市本町1丁目11-1
M000376,小林 聡,1984-07-08,男性,090-1252-4712,神奈川県横浜市青葉区市ケ尾5丁目15-3
M000377,佐藤 大輔,1983-01-12,男性,090-1504-2780,埼玉県さいたま市浦和区岸町4丁目15-5
M000378,吉田 聡,2003-10-11,男性,090-4110-6772,埼玉県さいたま市浦和区岸町3丁目10-12
M000379,鈴木 さくら,1958-10-12,女性,090-3259-1255,埼玉県川口市並木2丁目12-4
M000380,鈴木 杏,1981-01-17,女性,090-7288-8766,神奈川県横浜市青葉区美しが丘1丁目21-15
M000381,松本 拓也,1980-07-15,男性,090-7745-7102,神奈川県横浜市青葉区たまプラーザ1丁目26-2
M000382,井上 拓也,1996-09-16,男性,090-6755-5088,埼玉県川口市戸塚3丁目26-5
M000383,小林 杏,1979-04-01,女性,090-1372-1619,埼玉県川口市並木3丁目25-1
M000384,鈴木 恵,1963-10-03,女性,090-2658-2826,千葉県市川市八幡1丁目2-3
M000385,高橋 健一,2004-10-27,男性,090-1814-8567,東京都八王子市めじろ台3丁目4-1
M000386,加藤 彩,1956-06-11,女性,090-3931-5415,神奈川県横浜市青葉区市ケ尾2丁目18-17
M000387,田中 由美,1959-08-02,女性,090-5989-6717,埼玉県川口市並木4丁目5-18
M000388,伊藤 拓也,1970-06-26,男性,090-2330-9848,埼玉県さいたま市浦和区北浦和2丁目13-18
M000389,小林 麻衣,1977-06-07,女性,090-1299-4101,東京都大田区田園調布4丁目14-15
M000390,渡辺 恵,1963-06-16,女性,090-2804-4772,東京都杉並区荻窪2丁目24-2
M000391,山田 大輔,1985-06-02,男性,090-7841-2391,埼玉県さいたま市浦和区北浦和1丁目29-9
M000392,山田 拓也,1982-12-18,男性,090-6860-5688,東京都世田谷区経堂3丁目8-1
M000393,鈴木 浩二,1969-03-05,男性,090-9934-9918,神奈川県藤沢市辻堂2丁目6-4
M000394,山本 麻衣,1961-12-19,女性,090-2250-7517,神奈川県川崎市宮前区宮崎1丁目1-3
M000395,山田 由美,1990-01-14,女性,090-5243-3808,神奈川県横浜市青葉区たまプラーザ3丁目14-2
M000396,高橋 麻衣,1992-04-20,女性,090-7447-2473,埼玉県さいたま市浦和区北浦和2丁目6-2
M000397,伊藤 浩二,1974-12-14,男性,090-5226-6113,千葉県市川市八幡4丁目22-12
M000398,伊藤 陽子,2006-11-04,女性,090-8705-2691,埼玉県川口市芝2丁目24-13
M000399,鈴木 拓也,1977-03-21,男性,090-4685-6689,東京都八王子市北野2丁目17-1
M000400,山本 杏,1982-07-15,女性,090-1997-4016,千葉県市川市八幡4丁目9-12
M000401,中村 恵,1954-02-25,女性,090-7102-7340,東京都大田区大森2丁目7-5
M000402,佐藤 さくら,1975-01-19,女性,090-6483-8179,神奈川県川崎市宮前区宮崎3丁目27-7
M000403,吉田 愛,1980-09-12,女性,090-6591-1853,神奈川県川崎市宮前区有馬3丁目21-15
M000404,渡辺 彩,1980-07-16,女性,090-9058-1110,東京都八王子市南大沢3丁目6-14
M000405,松本 由美,1977-04-25,女性,090-6738-8715,埼玉県川口市並木3丁目7-7
M000406,加藤 遥,1992-06-13,女性,090-7373-9515,神奈川県横浜市青葉区美しが丘1丁目15-13
M000407,佐藤 亮,1956-09-26,男性,090-5910-3946,神奈川県横浜市青葉区美しが丘5丁目8-11
M000408,田中 浩二,1964-05-09,男性,090-2016-3556,千葉県市川市行徳2丁目24-12
M000409,木村 翔太,1954-01-23,男性,090-2715-3715,千葉県船橋市本町1丁目6-13
M000410,渡辺 美咲,1957-09-07,女性,090-4293-7598,神奈川県川崎市宮前区宮崎3丁目8-7
M000411,吉田 健一,1960-07-07,男性,090-1706-4337,神奈川県川崎市宮前区鷺沼3丁目3-9
M000412,渡辺 亮,1987-03-14,男性,090-5013-8572,東京都世田谷区上北沢3丁目24-3
M000413,渡辺 彩,1972-08-28,女性,090-4817-9253,神奈川県横浜市青葉区たまプラーザ5丁目17-6
M000414,中村 由美,1971-07-13,女性,090-9212-9663,神奈川県横浜市青葉区たまプラーザ1丁目3-12
M000415,渡辺 拓也,2005-11-10,男性,090-3282-3745,千葉県船橋市習志野台3丁目3-8
M000416,加藤 誠,1962-08-11,男性,090-7044-9712,千葉県市川市国府台4丁目5-10
M000417,吉田 翔太,1973-03-27,男性,090-8932-5988,埼玉県川口市戸塚4丁目13-14
M000418,吉田 遥,1993-02-03,女性,090-4677-5229,東京都世田谷区上北沢3丁目26-5
M000419,松本 大輔,1992-03-08,男性,090-8785-5534,東京都大田区田園調布4丁目1-14
M000420,佐藤 直樹,1983-03-25,男性,090-3534-4487,東京都世田谷区上北沢3丁目11-19
M000421,井上 杏,1948-05-10,女性,090-1339-9585,東京都大田区大森4丁目23-15
M000422,山本 遥,1958-11-03,女性,090-7280-8480,東京都世田谷区赤堤2丁目10-8
M000423,伊藤 陽子,1996-11-10,女性,090-8129-7617,東京都杉並区荻窪3丁目13-7
M000424,木村 由美,1969-08-28,女性,090-4184-7313,東京都大田区大森4丁目16-12
M000425,吉田 隆,1981-10-21,男性,090-2577-7109,神奈川県横浜市青葉区市ケ尾3丁目15-7
M000426,高橋 亮,1968-05-11,男性,090-8689-7288,埼玉県川口市並木2丁目25-2
M000427,木村 由美,1978-09-13,女性,090-9348-7887,神奈川県藤沢市湘南台3丁目29-7
M000428,木村 隆,1993-09-05,男性,090-3545-3629,神奈川県川崎市宮前区有馬5丁目18-15
M000429,吉田 拓也,1977-06-18,男性,090-4329-5735,神奈川県横浜市青葉区市ケ尾1丁目3-1
M000430,木村 遥,1987-10-28,女性,090-6979-1624,神奈川県横浜市青葉区たまプラーザ1丁目20-2
M000431,佐藤 さくら,1966-12-03,女性,090-2808-4386,神奈川県横浜市青葉区市ケ尾5丁目2-15
M000432,小林 健一,2000-07-20,男性,090-2776-7149,埼玉県川口市芝4丁目22-3
M000433,吉田 健一,1981-02-15,男性,090-9972-6830,埼玉県さいたま市浦和区北浦和2丁目6-18
M000434,井上 彩,1994-12-22,女性,090-8269-8739,東京都世田谷区上北沢2丁目20-15
M000435,高橋 美咲,1971-08-06,女性,090-1194-5077,千葉県船橋市本町5丁目18-1
M000436,加藤 誠,1986-11-15,男性,090-1469-9149,東京都大田区田園調布2丁目15-3
M000437,山田 由美,1979-10-26,女性,090-8907-9814,埼玉県さいたま市浦和区北浦和4丁目7-14
M000438,吉田 愛,1997-03-17,女性,090-5395-6449,埼玉県川口市芝5丁目25-3
M000439,佐々木 恵,1952-09-02,女性,090-5728-2716,東京都世田谷区赤堤1丁目13-3
M000440,伊藤 翔太,1957-04-23,男性,090-5187-6965,埼玉県さいたま市浦和区北浦和4丁目24-15
M000441,鈴木 彩,1985-10-12,女性,090-6787-4908,神奈川県横浜市青葉区美しが丘5丁目6-9
M000442,山田 遥,2000-12-08,女性,090-2836-3031,東京都大田区田園調布3丁目13-1
M000443,鈴木 麻衣,1976-12-09,女性,090-1315-3059,東京都世田谷区上北沢3丁目24-4
M000444,松本 誠,1990-08-10,男性,090-3568-9893,東京都杉並区荻窪1丁目10-15
M000445,鈴木 亮,1995-01-06,男性,090-3607-5944,埼玉県川口市戸塚3丁目17-2
M000446,渡辺 隆,1980-05-12,男性,090-1628-2848,千葉県船橋市北習志野2丁目9-14
M000447,井上 聡,1990-04-10,男性,090-9702-5946,千葉県船橋市北習志野3丁目26-17
M000448,小林 遥,1970-08-11,女性,090-1368-8482,東京都杉並区高円寺2丁目18-1
M000449,小林 美咲,1973-02-16,女性,090-3735-7701,神奈川県川崎市宮前区有馬3丁目27-4
M000450,鈴木 健一,1973-01-14,男性,090-2357-8325,東京都大田区大森4丁目4-8
M000451,佐藤 麻衣,1977-09-05,女性,090-4988-2733,埼玉県川口市芝2丁目9-19
M000452,加藤 亮,2003-03-04,男性,090-3791-9571,東京都大田区蒲田3丁目21-4
M000453,山本 聡,1958-06-01,男性,090-3633-3406,神奈川県横浜市青葉区美しが丘2丁目8-11
M000454,中村 恵,1974-04-16,女性,090-9743-2513,神奈川県川崎市宮前区宮崎5丁目15-1
M000455,小林 恵,1950-04-02,女性,090-3555-1851,東京都杉並区荻窪2丁目28-8
M000456,田中 麻衣,1986-04-04,女性,090-8924-1814,千葉県船橋市北習志野4丁目7-18
M000457,井上 隆,1970-04-28,男性,090-1030-4548,千葉県船橋市北習志野4丁目18-8
M000458,吉田 大輔,1988-09-12,男性,090-6188-1157,東京都世田谷区経堂4丁目24-12
M000459,高橋 大輔,1979-11-15,男性,090-1615-5999,東京都杉並区荻窪5丁目7-6
M000460,佐藤 直樹,1983-08-25,男性,090-8953-6023,東京都大田区大森1丁目10-10
M000461,小林 杏,2006-06-22,女性,090-8012-5373,東京都杉並区阿佐谷2丁目22-17
M000462,小林 由美,1985-06-15,女性,090-8482-2081,埼玉県さいたま市浦和区岸町3丁目14-17
M000463,鈴木 彩,1971-10-09,女性,090-3826-7233,東京都世田谷区赤堤3丁目16-3
M000464,山田 直樹,1979-10-15,男性,090-7730-8844,千葉県市川市行徳4丁目12-6
M000465,小林 愛,1966-09-26,女性,090-7228-1448,東京都大田区蒲田3丁目14-19
M000466,山田 さくら,1974-10-02,女性,090-8412-6872,東京都大田区蒲田5丁目27-9
M000467,井上 聡,2006-09-23,男性,090-3614-8630,東京都杉並区阿佐谷1丁目24-16
M000468,渡辺 亮,1980-04-27,男性,090-3001-9981,東京都世田谷区経堂2丁目29-16
M000469,伊藤 亮,2006-01-01,男性,090-3224-8885,埼玉県さいたま市浦和区常盤2丁目9-9
M000470,加藤 恵,1950-04-06,女性,090-1149-6074,神奈川県横浜市青葉区たまプラーザ4丁目4-4
M000471,松本 聡,1989-06-15,男性,090-6958-4289,神奈川県横浜市青葉区市ケ尾3丁目1-13
M000472,山田 遥,1978-01-15,女性,090-6039-9259,東京都八王子市北野5丁目20-10
M000473,鈴木 遥,1983-11-01,女性,090-4480-5189,東京都杉並区荻窪5丁目8-8
M000474,加藤 美咲,1988-07-10,女性,090-4900-9421,東京都杉並区高円寺3丁目3-19
M000475,中村 聡,1963-09-15,男性,090-3555-2748,埼玉県川口市芝2丁目3-15
M000476,加藤 拓也,1984-07-24,男性,090-9413-5689,東京都大田区田園調布2丁目6-16
M000477,松本 浩二,1965-11-25,男性,090-3485-6747,千葉県市川市行徳1丁目1-1
M000478,井上 陽子,1985-02-15,女性,090-7505-9215,東京都八王子市めじろ台4丁目9-9
M000479,木村 誠,2001-05-17,男性,090-3206-2586,東京都八王子市めじろ台5丁目22-4
M000480,山田 翔太,1956-10-12,男性,090-4598-7229,千葉県船橋市習志野台3丁目25-19
M000481,山本 陽子,2006-12-23,女性,090-1334-5633,埼玉県さいたま市浦和区北浦和5丁目5-18
M000482,鈴木 健一,1980-06-17,男性,090-7510-5098,千葉県船橋市習志野台4丁目26-11
M000483,吉田 恵,1989-05-04,女性,090-4978-1674,東京都杉並区高円寺5丁目2-4
M000484,高橋 翔太,1986-01-08,男性,090-5048-9179,神奈川県藤沢市辻堂3丁目13-18
M000485,田中 直樹,1984-11-08,男性,090-9295-9836,東京都世田谷区赤堤4丁目16-10
M000486,佐藤 誠,1985-05-01,男性,090-6648-2231,千葉県船橋市本町4丁目3-13
M000487,佐々木 愛,2006-08-13,女性,090-1948-1638,神奈川県川崎市宮前区宮崎5丁目26-14
M000488,伊藤 大輔,1978-03-13,男性,090-6619-6460,千葉県船橋市習志野台1丁目21-13
M000489,佐々木 彩,1986-03-10,女性,090-4562-8644,東京都世田谷区上北沢4丁目12-8
M000490,渡辺 直樹,1964-02-07,男性,090-7789-1485,東京都八王子市めじろ台2丁目21-12
M000491,田中 翔太,2006-01-12,男性,090-6327-5887,神奈川県横浜市青葉区市ケ尾3丁目14-13
M000492,山本 陽子,1991-06-03,女性,090-1188-1114,東京都世田谷区上北沢2丁目23-17
M000493,田中 亮,1955-01-18,男性,090-6214-3778,神奈川県横浜市青葉区市ケ尾3丁目7-9
M000494,松本 拓也,1971-09-10,男性,090-9011-1191,千葉県市川市行徳2丁目3-9
M000495,吉田 陽子,1989-08-21,女性,090-6425-9026,埼玉県さいたま市浦和区常盤1丁目6-14
M000496,井上 翔太,1961-06-03,男性,090-2876-7973,埼玉県さいたま市浦和区常盤4丁目22-10
M000497,木村 愛,1973-02-26,女性,090-7733-9419,東京都大田区大森2丁目19-4
M000498,佐藤 陽子,1969-02-05,女性,090-6453-8243,埼玉県川口市芝1丁目6-11
M000499,伊藤 翔太,1991-04-01,男性,090-5956-8117,東京都大田区田園調布4丁目5-9
M000500,田中 誠,1973-10-03,男性,090-3661-8517,神奈川県藤沢市辻堂2丁目7-3
M000501,井上 麻衣,1994-01-28,女性,090-4386-2888,神奈川県川崎市宮前区鷺沼1丁目23-18
M000502,加藤 健一,1982-10-23,男性,090-6175-4252,東京都大田区田園調布3丁目5-10
M000503,佐藤 さくら,1993-05-27,女性,090-8736-4130,東京都世田谷区赤堤2丁目24-15
M000504,吉田 麻衣,1985-03-28,女性,090-6466-7174,神奈川県横浜市青葉区市ケ尾4丁目8-7
M000505,高橋 隆,1976-08-10,男性,090-9745-5052,千葉県船橋市習志野台5丁目10-1
M000506,吉田 愛,1977-04-14,女性,090-3048-2588,東京都杉並区高円寺4丁目25-2
M000507,加藤 直樹,1981-09-02,男性,090-5558-1944,東京都世田谷区赤堤1丁目18-9
M000508,吉田 聡,1984-07-28,男性,090-7657-9515,千葉県船橋市北習志野3丁目9-13
M000509,鈴木 彩,1979-12-19,女性,090-7428-1960,千葉県市川市行徳5丁目14-12
M000510,山田 美咲,1969-07-04,女性,090-7937-3095,神奈川県藤沢市辻堂4丁目28-16
M000511,伊藤 陽子,1959-01-27,女性,090-3246-5184,千葉県市川市国府台3丁目20-6
M000512,井上 直樹,1997-01-12,男性,090-5483-7155,千葉県船橋市北習志野2丁目2-1
M000513,伊藤 浩二,1979-02-26,男性,090-5154-8685,神奈川県川崎市宮前区宮崎2丁目19-13
M000514,田中 亮,1958-08-28,男性,090-9593-9935,神奈川県川崎市宮前区宮崎5丁目23-4
M000515,加藤 聡,2006-09-07,男性,090-2312-5048,東京都大田区大森5丁目4-18
M000516,佐藤 隆,2001-04-01,男性,090-6162-4246,神奈川県横浜市青葉区美しが丘1丁目6-5
M000517,伊藤 彩,1990-04-06,女性,090-7885-9189,東京都大田区田園調布1丁目23-11
M000518,伊藤 聡,1974-04-25,男性,090-9272-3622,東京都大田区蒲田4丁目6-18
M000519,佐々木 美咲,1971-11-16,女性,090-7845-1088,東京都大田区蒲田4丁目8-17
M000520,鈴木 愛,2006-09-05,女性,090-3578-1411,神奈川県藤沢市湘南台3丁目1-13
M000521,加藤 美咲,1997-01-26,女性,090-6360-4964,神奈川県横浜市青葉区市ケ尾2丁目17-11
M000522,山本 翔太,1983-08-18,男性,090-3300-2053,東京都世田谷区経堂1丁目8-4
M000523,佐々木 由美,1964-05-12,女性,090-9449-1227,神奈川県川崎市宮前区鷺沼2丁目9-13
M000524,山本 聡,1998-11-10,男性,090-3729-5320,埼玉県川口市芝3丁目3-15
M000525,鈴木 美咲,1987-09-12,女性,090-2176-3748,千葉県船橋市本町2丁目9-9
M000526,渡辺 隆,1985-08-20,男性,090-8293-1299,東京都大田区蒲田3丁目10-13
M000527,伊藤 由美,1958-11-21,女性,090-1367-5661,神奈川県川崎市宮前区鷺沼1丁目6-15
M000528,佐藤 大輔,1956-01-28,男性,090-2081-8822,東京都世田谷区上北沢5丁目17-14
M000529,吉田 隆,1963-05-12,男性,090-2505-2796,東京都世田谷区上北沢5丁目3-12
M000530,渡辺 麻衣,1997-05-12,女性,090-6306-4039,東京都大田区蒲田4丁目6-16
M000531,加藤 隆,1983-01-12,男性,090-2320-1638,東京都杉並区高円寺2丁目18-12
M000532,小林 陽子,1983-01-25,女性,090-6334-3504,神奈川県川崎市宮前区有馬3丁目9-9
M000533,井上 聡,1987-01-27,男性,090-9329-3113,東京都世田谷区経堂4丁目2-17
M000534,小林 聡,1997-12-11,男性,090-1400-2633,神奈川県横浜市青葉区美しが丘5丁目4-2
M000535,井上 遥,1986-08-21,女性,090-9134-5217,東京都世田谷区上北沢5丁目18-8
M000536,松本 恵,1987-03-24,女性,090-1265-7116,東京都八王子市南大沢1丁目18-4
M000537,中村 隆,1988-01-13,男性,090-5580-4316,埼玉県川口市戸塚3丁目24-8
M000538,加藤 さくら,2002-10-19,女性,090-7954-4492,東京都杉並区高円寺4丁目21-10
M000539,渡辺 麻衣,1982-01-13,女性,090-4909-6513,埼玉県さいたま市浦和区岸町1丁目6-19
M000540,伊藤 隆,2006-06-26,男性,090-8664-8046,埼玉県さいたま市浦和区北浦和3丁目7-15
M000541,佐々木 健一,1977-03-04,男性,090-8177-7748,神奈川県横浜市青葉区市ケ尾5丁目20-18
