会員ID,氏名,生年月日,性別,電話番号,住所
M000812,田中 遥,1966-09-03,女性,090-6934-2445,神奈川県川崎市宮前区有馬3丁目21-15
M000813,木村 さくら,1964-01-16,女性,090-5049-5546,東京都世田谷区経堂2丁目6-12
M000814,鈴木 彩,1997-03-20,女性,090-7372-8944,東京都杉並区荻窪4丁目28-17
M000815,鈴木 遥,1965-07-09,女性,090-8061-8356,東京都杉並区高円寺4丁目18-16
M000816,小林 大輔,2002-11-13,男性,090-6240-9212,東京都大田区大森2丁目3-10
M000817,吉田 由美,1977-01-08,女性,090-9981-4500,神奈川県横浜市青葉区市ケ尾1丁目3-2
M000818,鈴木 愛,1979-10-27,女性,090-8442-4230,東京都世田谷区上北沢3丁目18-15
M000819,山本 麻衣,1995-11-14,女性,090-6949-3730,埼玉県さいたま市浦和区岸町2丁目3-8
M000820,鈴木 麻衣,1984-07-25,女性,090-7385-7432,東京都杉並区阿佐谷3丁目21-17
M000821,渡辺 大輔,1989-07-10,男性,090-6208-3834,東京都八王子市北野4丁目29-8
M000822,高橋 大輔,1979-07-02,男性,090-8548-2398,千葉県船橋市北習志野3丁目25-18
M000823,高橋 浩二,1995-11-21,男性,090-6347-1552,神奈川県藤沢市善行3丁目18-11
M000824,松本 由美,1975-02-26,女性,090-1127-8732,東京都世田谷区経堂5丁目29-17
M000825,渡辺 陽子,1992-05-22,女性,090-2194-4870,埼玉県さいたま市浦和区岸町5丁目26-6
M000826,伊藤 さくら,1970-02-07,女性,090-8036-1398,神奈川県川崎市宮前区宮崎2丁目3-13
M000827,田中 さくら,1983-04-08,女性,090-6681-3654,埼玉県川口市戸塚2丁目9-10
M000828,加藤 隆,1990-06-03,男性,090-3397-5878,東京都大田区蒲田5丁目15-1
M000829,伊藤 健一,1969-08-20,男性,090-6446-7382,埼玉県さいたま市浦和区北浦和4丁目24-18
M000830,田中 大輔,1990-01-15,男性,090-2853-9911,神奈川県横浜市青葉区たまプラーザ2丁目9-9
M000831,伊藤 由美,1984-05-19,女性,090-4444-4490,千葉県船橋市北習志野5丁目27-5
M000832,佐藤 さくら,1953-06-07,女性,090-8014-8445,千葉県市川市行徳1丁目29-15
M000833,佐々木 麻衣,1972-07-18,女性,090-7621-6414,東京都世田谷区経堂1丁目4-19
M000834,小林 聡,1953-08-20,男性,090-3119-9234,埼玉県さいたま市浦和区北浦和3丁目14-1
M000835,吉田 愛,1970-08-08,女性,090-6740-3297,埼玉県さいたま市浦和区北浦和2丁目8-14
M000836,渡辺 拓也,1978-12-22,男性,090-8986-2580,埼玉県川口市戸塚2丁目1-17
M000837,佐々木 大輔,1970-11-06,男性,090-7990-5675,千葉県船橋市本町4丁目12-5
M000838,松本 由美,1983-08-03,女性,090-7377-4370,東京都杉並区荻窪2丁目10-13
M000839,高橋 陽子,1984-06-25,女性,090-5615-9296,神奈川県横浜市青葉区市ケ尾5丁目19-5
M000840,小林 浩二,2004-07-12,男性,090-9095-3492,千葉県船橋市習志野台2丁目7-1
M000841,伊藤 彩,1991-12-06,女性,090-2797-6001,埼玉県川口市並木3丁目25-9
M000842,高橋 大輔,2006-04-05,男性,090-5154-6596,千葉県船橋市本町2丁目17-16
M000843,松本 誠,1964-08-03,男性,090-3438-5725,埼玉県さいたま市浦和区常盤5丁目6-1
M000844,田中 麻衣,1987-10-27,女性,090-4393-6128,東京都世田谷区赤堤1丁目27-19
M000845,中村 杏,1987-03-14,女性,090-1175-9735,神奈川県藤沢市善行3丁目25-12
M000846,佐藤 さくら,1963-12-07,女性,090-6738-2561,神奈川県横浜市青葉区市ケ尾1丁目26-2
M000847,佐々木 浩二,1992-12-14,男性,090-5338-6697,神奈川県横浜市青葉区市ケ尾5丁目12-17
M000848,松本 美咲,1997-02-01,女性,090-6206-3011,東京都杉並区阿佐谷4丁目5-10
M000849,佐々木 大輔,1961-12-27,男性,090-4434-1293,埼玉県川口市戸塚4丁目17-4
M000850,高橋 杏,1983-01-21,女性,090-1565-4687,東京都大田区大森2丁目6-5
M000851,山本 愛,1983-06-14,女性,090-5464-1330,東京都世田谷区経堂5丁目14-13
M000852,木村 亮,1969-07-03,男性,090-1221-2825,東京都大田区田園調布4丁目25-3
M000853,井上 翔太,1992-05-17,男性,090-5147-7386,千葉県船橋市本町1丁目12-14
M000854,鈴木 陽子,1965-04-16,女性,090-7615-8989,神奈川県横浜市青葉区美しが丘5丁目1-4
M000855,井上 大輔,1979-05-22,男性,090-7556-7838,神奈川県藤沢市善行1丁目2-16
M000856,松本 聡,1966-11-16,男性,090-4871-1764,千葉県船橋市本町3丁目28-17
M000857,吉田 誠,1970-05-01,男性,090-2669-7839,千葉県市川市国府台5丁目3-8
M000858,山田 翔太,1981-07-05,男性,090-6125-7470,神奈川県横浜市青葉区市ケ尾2丁目8-16
M000859,高橋 亮,1985-03-12,男性,090-9615-3093,東京都八王子市南大沢5丁目1-19
M000860,加藤 彩,2004-04-26,女性,090-5785-5709,東京都大田区大森5丁目5-9
M000861,渡辺 健一,1967-07-10,男性,090-8301-4079,千葉県市川市八幡1丁目20-8
M000862,鈴木 恵,1971-02-13,女性,090-1647-9192,埼玉県さいたま市浦和区常盤4丁目14-5
M000863,木村 亮,2004-12-11,男性,090-2272-4002,千葉県市川市国府台4丁目18-17
M000864,山本 拓也,1977-11-15,男性,090-1057-1576,神奈川県横浜市青葉区美しが丘2丁目28-14
M000865,田中 聡,1977-06-05,男性,090-3227-6153,東京都大田区田園調布5丁目25-2
M000866,田中 麻衣,1993-09-26,女性,090-3183-3468,千葉県市川市行徳5丁目19-17
M000867,小林 陽子,2006-09-01,女性,090-9303-6963,東京都杉並区阿佐谷4丁目18-16
M000868,高橋 さくら,1981-07-22,女性,090-3038-3703,千葉県船橋市北習志野3丁目9-17
M000869,松本 陽子,1994-07-06,女性,090-2964-2620,東京都世田谷区経堂4丁目14-6
M000870,佐藤 翔太,1958-10-02,男性,090-9466-6463,千葉県船橋市習志野台4丁目14-2
M000871,伊藤 健一,1975-01-03,男性,090-8708-2044,埼玉県さいたま市浦和区北浦和1丁目5-14
M000872,小林 さくら,1975-05-07,女性,090-4578-1424,埼玉県さいたま市浦和区岸町5丁目20-15
M000873,吉田 翔太,1970-12-18,男性,090-3881-9536,東京都八王子市南大沢4丁目5-12
M000874,小林 亮,1972-09-18,男性,090-8416-6172,東京都杉並区阿佐谷1丁目25-8
M000875,井上 隆,1993-09-22,男性,090-4274-9428,千葉県船橋市本町1丁目19-7
M000876,山本 聡,2006-04-25,男性,090-4615-7735,神奈川県横浜市青葉区たまプラーザ5丁目25-10
M000877,山本 翔太,1999-02-18,男性,090-9317-5633,千葉県船橋市本町2丁目22-1
M000878,吉田 愛,2006-10-25,女性,090-9059-5532,東京都八王子市北野4丁目14-8
M000879,田中 恵,1983-09-09,女性,090-7014-3854,東京都世田谷区経堂2丁目14-11
M000880,加藤 浩二,1993-03-09,男性,090-7724-2175,千葉県市川市国府台5丁目12-3
M000881,佐藤 遥,1984-11-09,女性,090-1658-6015,埼玉県川口市戸塚1丁目16-6
M000882,佐々木 陽子,2006-02-21,女性,090-5670-3247,東京都世田谷区上北沢3丁目28-4
M000883,中村 健一,1962-07-24,男性,090-7496-8698,千葉県船橋市本町4丁目4-1
M000884,佐藤 陽子,1990-04-21,女性,090-6903-3635,東京都世田谷区上北沢1丁目22-13
M000885,小林 恵,1968-08-06,女性,090-5485-1643,神奈川県横浜市青葉区市ケ尾3丁目1-12
M000886,吉田 由美,1986-03-10,女性,090-6512-4114,神奈川県横浜市青葉区市ケ尾4丁目8-7
M000887,木村 麻衣,1993-10-07,女性,090-5221-8955,東京都大田区田園調布2丁目19-12
M000888,田中 恵,2001-11-14,女性,090-4552-2359,東京都世田谷区上北沢5丁目6-7
M000889,田中 麻衣,1998-09-18,女性,090-6362-2450,東京都世田谷区経堂1丁目10-17
M000890,山田 誠,1955-08-14,男性,090-7573-1906,神奈川県川崎市宮前区鷺沼1丁目6-1
M000891,佐藤 麻衣,1967-04-23,女性,090-1095-4807,東京都杉並区高円寺5丁目8-13
M000892,山本 誠,1988-11-09,男性,090-8026-5878,東京都杉並区荻窪4丁目22-11
M000893,田中 大輔,2004-02-27,男性,090-8896-4832,東京都世田谷区赤堤4丁目8-2
M000894,渡辺 浩二,2000-08-17,男性,090-5087-9525,東京都大田区田園調布5丁目23-19
M000895,山本 隆,1962-06-19,男性,090-5317-2327,千葉県船橋市北習志野2丁目8-17
M000896,田中 直樹,2006-05-18,男性,090-4955-6386,東京都世田谷区経堂4丁目13-16
M000897,佐々木 さくら,1972-05-01,女性,090-2928-4362,東京都世田谷区経堂4丁目28-2
M000898,高橋 由美,1972-12-19,女性,090-4395-9075,神奈川県藤沢市湘南台2丁目19-10
M000899,小林 大輔,1984-12-03,男性,090-8082-6134,千葉県市川市行徳3丁目9-16
M000900,渡辺 陽子,1961-07-22,女性,090-4647-8970,神奈川県藤沢市湘南台3丁目4-17
