会員ID,氏名,生年月日,性別,電話番号,住所
M000542,佐藤 遥,1977-01-08,女性,090-2483-4203,東京都杉並区荻窪2丁目18-19
M000543,佐々木 浩二,1972-03-03,男性,090-5790-5506,東京都杉並区高円寺3丁目20-13
M000544,中村 恵,1980-03-20,女性,090-3881-3097,東京都世田谷区赤堤1丁目25-16
M000545,井上 聡,2000-01-15,男性,090-7758-3838,埼玉県川口市並木1丁目15-12
M000546,木村 聡,1982-06-22,男性,090-1755-4868,千葉県船橋市習志野台5丁目6-9
M000547,中村 麻衣,1953-01-10,女性,090-7971-2736,東京都世田谷区赤堤2丁目28-8
M000548,松本 浩二,1978-08-16,男性,090-9956-3544,埼玉県さいたま市浦和区北浦和4丁目20-18
M000549,山本 誠,1987-04-04,男性,090-4780-9780,神奈川県横浜市青葉区美しが丘3丁目15-4
M000550,中村 さくら,1985-07-08,女性,090-2614-4932,東京都八王子市北野1丁目25-16
M000551,吉田 亮,1981-03-13,男性,090-5447-6647,東京都杉並区高円寺4丁目28-2
M000552,中村 聡,1995-04-19,男性,090-5630-7422,神奈川県藤沢市湘南台5丁目12-7
M000553,渡辺 杏,1969-12-13,女性,090-1810-9166,千葉県船橋市習志野台3丁目19-12
M000554,佐々木 愛,1980-01-25,女性,090-2868-7723,東京都世田谷区経堂3丁目3-13
M000555,渡辺 翔太,2002-02-09,男性,090-7151-5567,神奈川県横浜市青葉区美しが丘3丁目20-16
M000556,木村 恵,2002-09-15,女性,090-8753-4372,埼玉県さいたま市浦和区岸町3丁目20-11
M000557,加藤 健一,1964-12-05,男性,090-2072-7060,埼玉県さいたま市浦和区岸町5丁目19-8
M000558,伊藤 聡,1987-06-23,男性,090-9952-4852,千葉県船橋市習志野台3丁目24-6
M000559,渡辺 陽子,1997-01-19,女性,090-4424-1874,埼玉県さいたま市浦和区北浦和1丁目13-7
M000560,伊藤 恵,1961-06-15,女性,090-7071-6926,神奈川県藤沢市湘南台5丁目24-13
M000561,渡辺 恵,1981-10-14,女性,090-1008-9106,千葉県市川市八幡5丁目26-15
M000562,山田 由美,1984-06-06,女性,090-8732-9725,千葉県市川市国府台4丁目4-9
M000563,高橋 愛,2001-06-07,女性,090-1132-9257,東京都杉並区荻窪2丁目5-4
M000564,高橋 恵,1978-08-11,女性,090-3741-7375,東京都世田谷区上北沢5丁目27-18
M000565,鈴木 麻衣,1999-11-04,女性,090-9108-3556,東京都杉並区荻窪2丁目12-10
M000566,高橋 聡,1992-04-08,男性,090-9666-3336,埼玉県川口市戸塚1丁目15-15
M000567,高橋 愛,1969-04-03,女性,090-6106-9056,神奈川県川崎市宮前区宮崎4丁目11-11
M000568,木村 誠,1993-08-17,男性,090-4745-6538,千葉県船橋市本町3丁目4-18
M000569,鈴木 陽子,1942-06-25,女性,090-7288-2273,東京都世田谷区経堂4丁目17-6
M000570,渡辺 彩,1972-10-27,女性,090-1420-1928,東京都杉並区阿佐谷1丁目11-2
M000571,加藤 麻衣,1959-09-08,女性,090-8115-9501,神奈川県横浜市青葉区たまプラーザ5丁目5-6
M000572,井上 亮,1989-03-08,男性,090-3527-6295,神奈川県川崎市宮前区有馬4丁目9-4
M000573,加藤 拓也,1972-05-17,男性,090-7220-6807,東京都杉並区荻窪4丁目3-10
M000574,渡辺 直樹,1999-08-20,男性,090-8822-8939,東京都大田区田園調布1丁目15-4
M000575,井上 健一,1970-04-14,男性,090-1097-3173,埼玉県川口市芝3丁目4-14
M000576,加藤 遥,1986-05-22,女性,090-2012-9305,埼玉県さいたま市浦和区岸町3丁目5-12
M000577,鈴木 愛,1994-10-15,女性,090-8632-8031,東京都八王子市北野4丁目27-10
M000578,伊藤 陽子,1999-01-22,女性,090-5951-1977,東京都杉並区阿佐谷1丁目8-10
M000579,山田 美咲,1983-03-03,女性,090-4367-1603,東京都八王子市北野3丁目16-8
M000580,小林 翔太,1967-07-19,男性,090-6953-3318,東京都世田谷区上北沢4丁目11-6
M000581,渡辺 麻衣,1986-09-08,女性,090-2914-8046,神奈川県川崎市宮前区宮崎4丁目22-2
M000582,中村 隆,1986-03-14,男性,090-8463-9233,神奈川県藤沢市湘南台3丁目16-2
M000583,高橋 陽子,1984-08-17,女性,090-2596-7997,東京都世田谷区上北沢3丁目6-17
M000584,山本 麻衣,1988-10-26,女性,090-3072-7988,東京都大田区大森1丁目9-2
M000585,加藤 大輔,1974-07-26,男性,090-7446-6023,神奈川県横浜市青葉区美しが丘2丁目27-16
M000586,山本 隆,1992-02-22,男性,090-9909-3387,神奈川県横浜市青葉区たまプラーザ5丁目17-10
M000587,中村 杏,1977-04-18,女性,090-2408-6135,東京都大田区大森3丁目28-2
M000588,鈴木 誠,1991-12-20,男性,090-4875-1172,東京都杉並区荻窪5丁目29-13
M000589,田中 浩二,1974-11-17,男性,090-2469-6837,東京都大田区田園調布5丁目21-14
M000590,山本 亮,1993-12-12,男性,090-6329-2466,埼玉県川口市並木3丁目22-14
M000591,山田 遥,1984-02-10,女性,090-6085-7298,東京都世田谷区経堂1丁目8-18
M000592,渡辺 拓也,1980-11-01,男性,090-5546-1320,千葉県船橋市本町3丁目16-2
M000593,小林 さくら,1979-05-01,女性,090-6640-9129,千葉県船橋市北習志野4丁目7-8
M000594,吉田 翔太,1977-08-15,男性,090-6768-1117,千葉県船橋市習志野台1丁目8-14
M000595,伊藤 愛,1991-05-18,女性,090-5493-5345,東京都杉並区阿佐谷3丁目1-16
M000596,吉田 彩,1982-03-02,女性,090-2045-4618,埼玉県川口市戸塚4丁目3-3
M000597,鈴木 直樹,1978-11-06,男性,090-4694-9009,東京都大田区田園調布1丁目14-1
M000598,田中 誠,1964-02-28,男性,090-5151-5982,千葉県船橋市北習志野5丁目19-15
M000599,佐藤 直樹,1979-07-23,男性,090-2557-9197,千葉県市川市行徳5丁目1-2
M000600,中村 隆,1979-06-23,男性,090-3725-4775,神奈川県藤沢市湘南台4丁目24-18
M000601,田中 聡,1983-02-14,男性,090-3116-3447,東京都大田区田園調布2丁目18-1
M000602,渡辺 遥,1997-11-17,女性,090-9703-4632,埼玉県さいたま市浦和区常盤5丁目29-5
M000603,山田 直樹,1969-10-02,男性,090-7723-1939,埼玉県さいたま市浦和区常盤4丁目16-8
M000604,山田 さくら,1953-02-01,女性,090-9923-1846,東京都世田谷区上北沢2丁目28-2
M000605,伊藤 由美,1974-04-03,女性,090-6814-5582,神奈川県川崎市宮前区宮崎4丁目12-9
M000606,加藤 浩二,1969-12-25,男性,090-9556-8016,東京都八王子市めじろ台5丁目24-12
M000607,伊藤 美咲,1991-10-21,女性,090-4926-8029,東京都八王子市めじろ台3丁目10-18
M000608,松本 さくら,1968-02-03,女性,090-9437-9769,神奈川県横浜市青葉区美しが丘2丁目14-3
M000609,田中 大輔,1986-04-25,男性,090-8917-2177,東京都杉並区高円寺2丁目10-1
M000610,鈴木 隆,1974-03-24,男性,090-2367-6016,埼玉県さいたま市浦和区常盤3丁目11-11
M000611,松本 杏,1971-07-07,女性,090-9569-8763,埼玉県川口市戸塚1丁目10-6
M000612,松本 健一,1965-12-14,男性,090-1765-1695,神奈川県川崎市宮前区宮崎1丁目14-3
M000613,中村 大輔,1960-01-20,男性,090-3711-6088,千葉県船橋市北習志野5丁目4-5
M000614,伊藤 遥,1990-03-12,女性,090-4249-2795,埼玉県さいたま市浦和区北浦和1丁目23-4
M000615,中村 遥,1989-08-20,女性,090-7370-1993,埼玉県川口市並木3丁目27-5
M000616,井上 さくら,1964-05-02,女性,090-4167-5879,千葉県船橋市習志野台3丁目8-3
M000617,田中 陽子,1971-07-13,女性,090-6122-2486,神奈川県川崎市宮前区有馬4丁目18-19
M000618,山田 美咲,1974-10-23,女性,090-6620-7210,東京都世田谷区経堂5丁目20-16
M000619,鈴木 聡,1960-04-28,男性,090-5118-2631,東京都杉並区高円寺3丁目9-15
M000620,中村 隆,1962-03-16,男性,090-3943-2217,神奈川県横浜市青葉区市ケ尾5丁目24-4
M000621,中村 恵,1992-01-23,女性,090-5918-8047,埼玉県さいたま市浦和区岸町4丁目11-18
M000622,高橋 麻衣,1961-07-18,女性,090-2086-2570,神奈川県横浜市青葉区美しが丘4丁目22-15
M000623,木村 遥,1962-07-06,女性,090-6346-7463,神奈川県川崎市宮前区鷺沼2丁目13-10
M000624,井上 翔太,1992-04-28,男性,090-6587-8415,埼玉県さいたま市浦和区北浦和1丁目19-7
M000625,伊藤 直樹,1962-06-07,男性,090-9477-6356,東京都世田谷区経堂1丁目18-10
M000626,吉田 亮,1987-05-20,男性,090-3747-7877,千葉県船橋市本町2丁目15-4
M000627,佐々木 翔太,1972-08-10,男性,090-7596-6226,神奈川県横浜市青葉区たまプラーザ1丁目27-9
M000628,伊藤 誠,2006-11-15,男性,090-8161-2896,神奈川県横浜市青葉区たまプラーザ4丁目10-15
M000629,山本 杏,1991-10-05,女性,090-5375-4373,東京都世田谷区経堂2丁目14-2
M000630,伊藤 杏,1993-05-24,女性,090-8298-2872,神奈川県川崎市宮前区宮崎2丁目22-11
M000631,鈴木 翔太,2006-11-11,男性,090-3553-2350,東京都世田谷区経堂4丁目3-1
M000632,渡辺 浩二,1976-08-04,男性,090-7491-9748,東京都八王子市めじろ台1丁目1-12
M000633,松本 恵,1948-02-17,女性,090-4079-3474,東京都杉並区阿佐谷3丁目6-11
M000634,山本 誠,1963-04-07,男性,090-8026-8253,東京都世田谷区経堂3丁目3-7
M000635,加藤 大輔,1998-07-23,男性,090-5758-2235,東京都世田谷区経堂5丁目23-1
M000636,木村 直樹,1978-03-09,男性,090-7687-8983,東京都大田区大森5丁目5-18
M000637,高橋 大輔,1995-02-28,男性,090-3652-1455,神奈川県藤沢市善行3丁目25-9
M000638,木村 直樹,1951-02-12,男性,090-9178-9859,東京都世田谷区経堂2丁目11-10
M000639,吉田 彩,1968-05-09,女性,090-8551-7239,東京都杉並区高円寺1丁目20-8
M000640,山田 誠,1989-03-18,男性,090-1113-8048,東京都杉並区荻窪3丁目17-19
M000641,山本 彩,1977-02-04,女性,090-3667-9229,神奈川県藤沢市善行3丁目13-4
M000642,田中 亮,1971-11-17,男性,090-7724-1676,東京都大田区蒲田3丁目8-3
M000643,松本 隆,1984-10-17,男性,090-6954-1186,東京都世田谷区上北沢3丁目24-7
M000644,中村 麻衣,1986-02-06,女性,090-3795-6433,東京都杉並区阿佐谷4丁目28-10
M000645,鈴木 亮,1991-03-28,男性,090-9938-4082,神奈川県横浜市青葉区たまプラーザ5丁目20-17
M000646,山田 大輔,1999-03-12,男性,090-7776-9895,東京都世田谷区赤堤4丁目19-4
M000647,山田 恵,1967-01-03,女性,090-1416-3330,神奈川県川崎市宮前区鷺沼1丁目13-4
M000648,佐藤 誠,1960-08-13,男性,090-6583-6423,神奈川県横浜市青葉区たまプラーザ1丁目6-2
M000649,伊藤 拓也,1973-02-15,男性,090-6816-9909,神奈川県横浜市青葉区市ケ尾4丁目28-17
M000650,山田 誠,1942-12-13,男性,090-7130-6806,東京都世田谷区上北沢1丁目5-9
M000651,佐々木 遥,1991-03-15,女性,090-8280-7680,神奈川県横浜市青葉区美しが丘1丁目17-14
M000652,鈴木 由美,1993-05-25,女性,090-7174-8656,埼玉県川口市戸塚2丁目10-18
M000653,井上 健一,2000-04-13,男性,090-1459-6798,東京都世田谷区上北沢2丁目4-8
M000654,佐藤 さくら,1978-11-25,女性,090-2394-6005,東京都世田谷区経堂2丁目28-14
M000655,佐々木 健一,2003-01-11,男性,090-6136-6843,東京都世田谷区赤堤1丁目26-18
M000656,高橋 陽子,1977-07-05,女性,090-4953-1564,東京都八王子市北野5丁目20-13
M000657,高橋 陽子,1981-07-17,女性,090-9841-9684,神奈川県藤沢市善行4丁目19-17
M000658,山田 誠,1976-12-07,男性,090-2645-4577,千葉県船橋市本町2丁目4-9
M000659,木村 直樹,1942-07-09,男性,090-1367-9957,東京都大田区大森3丁目28-10
M000660,中村 隆,2002-04-15,男性,090-3185-2519,東京都大田区大森1丁目3-11
M000661,吉田 杏,1982-05-14,女性,090-4909-3816,神奈川県藤沢市辻堂1丁目23-4
M000662,小林 直樹,1991-09-21,男性,090-7145-5683,東京都杉並区阿佐谷3丁目6-12
M000663,木村 麻衣,1971-06-14,女性,090-9106-5384,埼玉県川口市戸塚3丁目27-10
M000664,松本 直樹,1974-09-10,男性,090-2096-7031,東京都大田区蒲田4丁目6-18
M000665,吉田 愛,1942-06-26,女性,090-2322-2810,埼玉県さいたま市浦和区岸町2丁目20-17
M000666,井上 聡,1991-01-27,男性,090-4556-4272,埼玉県川口市戸塚1丁目25-7
M000667,井上 隆,1996-02-19,男性,090-5564-6282,東京都杉並区荻窪4丁目6-19
M000668,井上 美咲,1972-09-10,女性,090-4948-6566,千葉県船橋市本町5丁目8-16
M000669,佐々木 彩,1979-09-20,女性,090-5306-1123,東京都世田谷区上北沢4丁目20-13
M000670,小林 杏,1970-03-04,女性,090-5805-7580,神奈川県横浜市青葉区美しが丘1丁目1-2
M000671,山本 陽子,1972-03-09,女性,090-6253-2834,東京都杉並区荻窪1丁目10-17
M000672,小林 恵,1995-07-05,女性,090-2910-7716,神奈川県横浜市青葉区たまプラーザ4丁目15-9
M000673,木村 遥,1984-03-04,女性,090-8962-5030,東京都八王子市めじろ台3丁目2-11
M000674,山本 健一,1968-11-05,男性,090-9374-4445,神奈川県横浜市青葉区市ケ尾3丁目26-11
M000675,伊藤 陽子,1989-12-03,女性,090-6926-4895,埼玉県さいたま市浦和区常盤3丁目15-2
M000676,中村 亮,1973-02-13,男性,090-6778-6432,東京都大田区大森2丁目22-17
M000677,山田 麻衣,1969-03-04,女性,090-9642-5571,千葉県船橋市本町3丁目15-19
M000678,鈴木 聡,1952-12-03,男性,090-9787-2734,神奈川県川崎市宮前区鷺沼1丁目24-5
M000679,山田 美咲,1975-06-19,女性,090-1168-7297,埼玉県さいたま市浦和区岸町1丁目8-19
M000680,鈴木 浩二,1976-10-17,男性,090-9292-5633,神奈川県横浜市青葉区たまプラーザ5丁目2-13
M000681,山本 麻衣,1961-03-05,女性,090-4003-2522,埼玉県川口市並木5丁目13-11
M000682,渡辺 陽子,1964-02-24,女性,090-8803-1087,東京都八王子市南大沢3丁目29-15
M000683,井上 誠,1970-09-24,男性,090-4096-7003,神奈川県川崎市宮前区有馬4丁目25-15
M000684,加藤 由美,2006-12-25,女性,090-6483-7466,東京都大田区田園調布2丁目18-13
M000685,吉田 亮,1962-11-14,男性,090-9933-5976,東京都杉並区荻窪1丁目12-16
M000686,吉田 誠,1961-06-20,男性,090-5905-5218,神奈川県横浜市青葉区市ケ尾2丁目4-15
M000687,山本 誠,2000-12-17,男性,090-7764-9290,埼玉県さいたま市浦和区北浦和3丁目1-9
M000688,佐々木 亮,1946-10-08,男性,090-5608-2433,千葉県船橋市本町4丁目9-19
M000689,渡辺 杏,1961-12-18,女性,090-5278-1624,東京都世田谷区上北沢3丁目21-17
M000690,山田 直樹,1993-04-05,男性,090-6455-4380,神奈川県藤沢市湘南台4丁目6-13
M000691,加藤 浩二,1972-09-05,男性,090-5780-7139,東京都大田区田園調布2丁目3-1
M000692,山田 翔太,1969-09-03,男性,090-4903-9506,神奈川県藤沢市辻堂4丁目23-6
M000693,井上 彩,1965-09-16,女性,090-1713-9327,東京都杉並区阿佐谷5丁目6-7
M000694,佐々木 浩二,2003-12-26,男性,090-6257-7849,東京都大田区蒲田4丁目11-18
M000695,伊藤 彩,2002-03-06,女性,090-1001-5005,神奈川県川崎市宮前区鷺沼5丁目18-9
M000696,木村 拓也,1979-08-12,男性,090-9809-8915,東京都杉並区阿佐谷2丁目10-6
M000697,中村 由美,1985-07-08,女性,090-7221-9330,千葉県船橋市習志野台2丁目25-6
M000698,山本 由美,1956-01-05,女性,090-2905-4202,東京都世田谷区経堂1丁目19-17
M000699,木村 遥,1974-10-08,女性,090-4557-3494,埼玉県川口市並木3丁目13-11
M000700,鈴木 由美,1999-02-09,女性,090-2520-5739,神奈川県川崎市宮前区有馬5丁目12-14
M000701,山本 拓也,1958-07-16,男性,090-4877-4599,東京都杉並区荻窪3丁目24-16
M000702,鈴木 浩二,1989-04-22,男性,090-3358-5517,埼玉県さいたま市浦和区北浦和1丁目22-9
M000703,渡辺 愛,1981-07-24,女性,090-3504-1885,神奈川県藤沢市湘南台1丁目17-1
M000704,田中 美咲,1988-02-21,女性,090-2922-3076,千葉県船橋市本町5丁目27-8
M000705,鈴木 浩二,1978-07-03,男性,090-8916-3017,千葉県船橋市北習志野4丁目23-1
M000706,田中 杏,1991-01-06,女性,090-9618-4055,東京都杉並区阿佐谷1丁目10-9
M000707,佐藤 隆,1995-03-17,男性,090-1978-8685,千葉県船橋市本町1丁目14-9
M000708,田中 麻衣,1961-07-21,女性,090-2919-5775,東京都世田谷区経堂3丁目6-1
M000709,山本 麻衣,1960-09-15,女性,090-6872-4865,埼玉県さいたま市浦和区常盤2丁目13-16
M000710,小林 麻衣,1961-05-17,女性,090-4745-6048,千葉県船橋市習志野台4丁目13-14
M000711,佐藤 麻衣,1989-10-09,女性,090-1603-4857,千葉県市川市国府台2丁目4-4
M000712,佐々木 陽子,1987-04-02,女性,090-3216-4971,東京都杉並区高円寺2丁目4-12
M000713,鈴木 麻衣,1970-07-12,女性,090-4487-7444,神奈川県川崎市宮前区鷺沼4丁目3-18
M000714,佐藤 健一,1970-08-04,男性,090-6938-6721,東京都杉並区荻窪4丁目12-5
M000715,渡辺 翔太,1970-02-05,男性,090-1352-8194,千葉県船橋市北習志野3丁目1-11
M000716,吉田 隆,2000-03-26,男性,090-6432-6096,埼玉県さいたま市浦和区岸町5丁目15-9
M000717,田中 浩二,1981-11-02,男性,090-8177-2483,東京都杉並区荻窪2丁目23-6
M000718,井上 杏,2005-10-04,女性,090-2677-9864,東京都大田区田園調布2丁目10-5
M000719,吉田 さくら,2002-08-25,女性,090-8905-5442,神奈川県横浜市青葉区美しが丘1丁目2-19
M000720,山本 隆,1982-04-13,男性,090-4072-6848,東京都世田谷区赤堤3丁目4-19
M000721,木村 さくら,1984-06-22,女性,090-8770-2171,千葉県船橋市北習志野3丁目20-15
M000722,高橋 誠,1968-07-20,男性,090-4030-9954,神奈川県横浜市青葉区たまプラーザ2丁目28-11
M000723,小林 亮,1967-09-12,男性,090-1418-3340,東京都大田区田園調布3丁目4-2
M000724,井上 拓也,1980-08-02,男性,090-1450-5697,神奈川県横浜市青葉区たまプラーザ3丁目22-17
M000725,田中 聡,1973-10-11,男性,090-9174-1355,神奈川県藤沢市湘南台2丁目20-6
M000726,山田 大輔,1988-06-04,男性,090-2940-7257,東京都杉並区荻窪3丁目9-16
M000727,田中 大輔,1981-07-28,男性,090-7143-4912,東京都杉並区阿佐谷3丁目29-7
M000728,渡辺 翔太,1954-09-25,男性,090-5892-6938,千葉県船橋市本町1丁目19-8
M000729,佐々木 翔太,1967-01-17,男性,090-4228-2344,神奈川県川崎市宮前区有馬3丁目22-8
M000730,佐藤 亮,1970-03-05,男性,090-6313-6543,神奈川県藤沢市善行3丁目18-12
M000731,加藤 直樹,1970-11-13,男性,090-2871-9957,埼玉県さいたま市浦和区岸町1丁目11-9
M000732,山本 麻衣,1987-03-23,女性,090-3211-6245,埼玉県川口市並木2丁目13-1
M000733,井上 陽子,1982-10-24,女性,090-8914-4070,東京都杉並区阿佐谷5丁目23-1
M000734,山本 彩,1990-05-20,女性,090-9891-9902,東京都大田区大森1丁目20-14
M000735,伊藤 恵,1991-03-14,女性,090-2161-5908,埼玉県さいたま市浦和区岸町3丁目8-8
M000736,中村 遥,1967-07-17,女性,090-5367-6732,神奈川県川崎市宮前区有馬1丁目17-10
M000737,吉田 翔太,1970-02-27,男性,090-1077-3766,東京都世田谷区赤堤5丁目14-12
M000738,井上 さくら,2005-05-28,女性,090-6548-2575,千葉県市川市国府台4丁目23-4
M000739,山本 翔太,1989-07-28,男性,090-2666-8424,東京都世田谷区赤堤3丁目20-14
M000740,中村 麻衣,1966-11-23,女性,090-9154-4527,神奈川県横浜市青葉区美しが丘3丁目15-4
M000741,高橋 陽子,1980-03-18,女性,090-3032-8750,東京都世田谷区赤堤2丁目18-16
M000742,田中 隆,2002-12-25,男性,090-4997-4896,東京都杉並区阿佐谷5丁目23-10
M000743,山田 愛,1982-07-03,女性,090-5089-8223,千葉県船橋市本町3丁目29-16
M000744,鈴木 愛,1973-08-25,女性,090-7872-4372,埼玉県川口市戸塚3丁目24-11
M000745,佐々木 浩二,1987-03-21,男性,090-4991-5668,埼玉県川口市芝3丁目14-4
M000746,井上 遥,1984-02-20,女性,090-1845-1368,東京都世田谷区経堂2丁目21-17
M000747,田中 杏,1989-04-07,女性,090-4014-7757,神奈川県川崎市宮前区鷺沼2丁目26-5
M000748,小林 杏,1992-07-26,女性,090-1623-1948,東京都八王子市めじろ台2丁目29-11
M000749,佐藤 翔太,1976-01-16,男性,090-8270-4289,神奈川県横浜市青葉区美しが丘4丁目6-19
M000750,吉田 陽子,2000-01-26,女性,090-2575-1589,東京都八王子市南大沢1丁目10-19
M000751,渡辺 翔太,1963-01-21,男性,090-6368-9019,千葉県船橋市北習志野3丁目23-14
M000752,松本 恵,1959-07-02,女性,090-4478-3542,埼玉県さいたま市浦和区常盤5丁目7-7
M000753,高橋 由美,1966-09-06,女性,090-9248-8535,千葉県船橋市習志野台4丁目10-14
M000754,井上 恵,1964-08-07,女性,090-8376-6334,埼玉県川口市戸塚4丁目3-16
M000755,鈴木 拓也,1994-03-22,男性,090-7218-8214,東京都八王子市北野4丁目13-13
M000756,佐藤 遥,1951-01-23,女性,090-2720-3485,東京都世田谷区経堂3丁目23-4
M000757,松本 杏,1966-03-04,女性,090-6085-9744,東京都世田谷区経堂5丁目24-1
M000758,山本 愛,1986-10-07,女性,090-4314-6554,千葉県船橋市本町2丁目21-7
M000759,井上 直樹,1983-08-03,男性,090-6384-5402,埼玉県川口市戸塚3丁目7-5
M000760,高橋 直樹,1988-07-13,男性,090-5089-2094,埼玉県川口市並木1丁目24-11
M000761,木村 直樹,1971-05-04,男性,090-2995-2217,埼玉県川口市戸塚3丁目26-7
M000762,鈴木 愛,1968-01-17,女性,090-2869-8569,東京都八王子市めじろ台1丁目18-10
M000763,高橋 さくら,2003-09-22,女性,090-2549-2190,東京都大田区蒲田2丁目5-16
M000764,伊藤 恵,2003-09-15,女性,090-9416-1143,千葉県船橋市本町5丁目12-17
M000765,山田 健一,1981-09-01,男性,090-5831-6845,埼玉県さいたま市浦和区岸町2丁目10-7
M000766,加藤 大輔,1991-07-16,男性,090-8231-5808,東京都八王子市北野1丁目25-19
M000767,伊藤 大輔,2003-07-06,男性,090-9974-7309,東京都杉並区高円寺2丁目7-17
M000768,松本 陽子,1962-05-27,女性,090-6471-1967,神奈川県藤沢市辻堂3丁目5-5
M000769,鈴木 愛,1982-08-28,女性,090-2843-2448,神奈川県横浜市青葉区市ケ尾1丁目6-18
M000770,伊藤 浩二,2001-09-22,男性,090-1349-2405,東京都大田区蒲田3丁目9-2
M000771,中村 恵,1980-08-22,女性,090-3152-1342,埼玉県さいたま市浦和区岸町1丁目27-13
M000772,中村 遥,1991-09-10,女性,090-3414-9451,埼玉県さいたま市浦和区岸町5丁目6-3
M000773,佐藤 彩,1956-09-25,女性,090-6635-8109,神奈川県横浜市青葉区たまプラーザ3丁目26-10
M000774,木村 翔太,1972-09-28,男性,090-8598-7666,神奈川県川崎市宮前区鷺沼3丁目1-15
M000775,加藤 彩,1984-11-16,女性,090-1412-9657,東京都八王子市南大沢5丁目9-19
M000776,山本 麻衣,1983-02-23,女性,090-6772-5359,東京都世田谷区赤堤1丁目25-18
M000777,高橋 誠,1964-04-26,男性,090-5707-1660,東京都杉並区高円寺4丁目2-3
M000778,山本 美咲,1981-07-14,女性,090-8413-9832,神奈川県横浜市青葉区たまプラーザ2丁目15-4
M000779,中村 遥,1964-04-23,女性,090-6111-4214,神奈川県横浜市青葉区市ケ尾2丁目24-7
M000780,木村 恵,1976-08-23,女性,090-9722-6422,東京都杉並区荻窪1丁目20-17
M000781,山田 浩二,1973-04-01,男性,090-4668-7483,千葉県船橋市習志野台3丁目15-9
M000782,加藤 隆,2000-10-18,男性,090-2272-6544,埼玉県川口市戸塚5丁目17-6
M000783,吉田 由美,1976-11-10,女性,090-7292-3603,神奈川県横浜市青葉区市ケ尾1丁目13-6
M000784,中村 翔太,1994-05-08,男性,090-3054-6437,神奈川県横浜市青葉区市ケ尾5丁目5-15
M000785,田中 彩,1990-09-25,女性,090-3504-1230,千葉県船橋市本町2丁目15-7
M000786,佐々木 隆,1992-07-07,男性,090-3200-5726,埼玉県川口市並木4丁目21-18
M000787,渡辺 彩,1991-05-10,女性,090-8325-8852,東京都大田区田園調布1丁目28-13
M000788,小林 由美,2006-10-28,女性,090-1522-2137,東京都大田区蒲田3丁目3-9
M000789,鈴木 誠,2000-07-05,男性,090-5311-1279,神奈川県川崎市宮前区宮崎4丁目22-15
M000790,松本 麻衣,1976-06-02,女性,090-5395-9588,東京都世田谷区経堂2丁目18-8
M000791,佐藤 さくら,1985-06-24,女性,090-7104-2089,東京都世田谷区経堂3丁目15-13
M000792,高橋 恵,1968-06-06,女性,090-2393-5763,東京都大田区蒲田2丁目7-14
M000793,伊藤 直樹,1989-07-15,男性,090-4371-3912,埼玉県川口市芝3丁目21-10
M000794,佐々木 大輔,1981-10-01,男性,090-9867-8334,神奈川県川崎市宮前区宮崎2丁目23-5
M000795,渡辺 亮,1966-05-23,男性,090-6503-3698,東京都杉並区阿佐谷5丁目18-2
M000796,田中 翔太,1997-01-13,男性,090-4533-2892,千葉県船橋市本町1丁目27-4
M000797,佐々木 大輔,1991-03-19,男性,090-7013-3158,千葉県船橋市北習志野5丁目23-10
M000798,中村 麻衣,1969-09-14,女性,090-4600-9554,神奈川県藤沢市善行3丁目14-15
M000799,佐藤 大輔,1971-01-11,男性,090-7976-6619,神奈川県川崎市宮前区宮崎1丁目24-4
M000800,松本 愛,1973-10-16,女性,090-7275-8595,神奈川県藤沢市湘南台2丁目14-1
M000801,佐藤 彩,1985-08-11,女性,090-7358-1130,東京都八王子市北野1丁目1-6
M000802,加藤 浩二,1955-08-20,男性,090-7297-1309,東京都八王子市北野2丁目16-5
M000803,山田 陽子,1950-06-12,女性,090-3455-2279,埼玉県川口市並木3丁目5-5
M000804,井上 大輔,1985-02-07,男性,090-9735-3473,神奈川県川崎市宮前区宮崎5丁目18-15
M000805,吉田 麻衣,1990-04-12,女性,090-3491-4878,東京都世田谷区赤堤4丁目3-12
M000806,小林 直樹,2006-07-18,男性,090-2892-3589,神奈川県藤沢市善行4丁目15-12
M000807,渡辺 麻衣,1980-01-24,女性,090-4006-2039,東京都杉並区阿佐谷4丁目6-9
M000808,山田 隆,1998-02-09,男性,090-6369-5363,埼玉県さいたま市浦和区北浦和4丁目29-2
M000809,高橋 由美,1982-04-07,女性,090-9058-7903,埼玉県さいたま市浦和区岸町1丁目25-15
M000810,山本 麻衣,1985-03-20,女性,090-2976-6512,神奈川県川崎市宮前区鷺沼3丁目29-16
M000811,高橋 恵,1990-05-18,女性,090-3723-3949,東京都世田谷区赤堤4丁目29-14
